positive,negative,rating,comments
Sve je bilo prelijepo,Nema nista da mi se nije dopalo,10,Sve je bilo prelijepo Nema nista da mi se nije dopalo
Sve je bilo u redu!,,10,Sve je bilo u redu! 
"Sve preporuke,lokacija top,cisto top sve",,10,"Sve preporuke,lokacija top,cisto top sve "
Sve,Nista,10,Sve Nista
Lokacija,"Hladan, prljav",2,"Lokacija Hladan, prljav"
Udobnost kreveta,"Kupatilo ne dovoljno 캜isto, oseti se vlaga u apartmanu",5,"Udobnost kreveta Kupatilo ne dovoljno 캜isto, oseti se vlaga u apartmanu"
"Apartman , cist i uredan , sve pohvale ..",Parking ! Kao prvo nije bezbjedan . Insistiraju da se parkirarate skroz do zida .. zaposlena nas je bukvalno maltretirala i vracala 3 puta da auto bude skroz do zida kako je ona zamislila . Pritom  umalo smo ostetili auto .. jer je parking u suterenu i ni malo nije bezbjedan ..,3,"Apartman , cist i uredan , sve pohvale .. Parking ! Kao prvo nije bezbjedan . Insistiraju da se parkirarate skroz do zida .. zaposlena nas je bukvalno maltretirala i vracala 3 puta da auto bude skroz do zida kako je ona zamislila . Pritom  umalo smo ostetili auto .. jer je parking u suterenu i ni malo nije bezbjedan .."
"Blizina Centra,cistoca,udobnost",,10,"Blizina Centra,cistoca,udobnost "
"Sve je perfektno: lokacija, parking, smje코taj, hrana,osoblje
Detalji su za pohvaliti游녪游녪",,10,"Sve je perfektno: lokacija, parking, smje코taj, hrana,osoblje
Detalji su za pohvaliti游녪游녪 "
Ljubaznost zaposlenih u restoranu je izvan svih o캜ekivanja. Odli캜an dizajn. Udobni kreveti. Izuzetno 캜isto. Lokacija odli캜na. Podzemna gara쬬 je odli캜na varijanta za centar grada.,Na recepciji je uvek neka problematika. Ali ipak je celokupan utisak jako dobar.,10,Ljubaznost zaposlenih u restoranu je izvan svih o캜ekivanja. Odli캜an dizajn. Udobni kreveti. Izuzetno 캜isto. Lokacija odli캜na. Podzemna gara쬬 je odli캜na varijanta za centar grada. Na recepciji je uvek neka problematika. Ali ipak je celokupan utisak jako dobar.
,"soba nije imala dnevnu svetlost,i konstantno je bila buka ( ne znam da li od centralne klimatizacije ili ne캜eg drugog).
Ostalo je zaista sve lepo i 캜isto.",9," soba nije imala dnevnu svetlost,i konstantno je bila buka ( ne znam da li od centralne klimatizacije ili ne캜eg drugog).
Ostalo je zaista sve lepo i 캜isto."
"Lokacija odli캜na, odmah pored reke. Moderno ure캠en hotel, krevet izuzetno udoban. Doru캜ak odli캜an, osoblje izuzetno ljubazno. Bezbedan parking u podzemnoj gara쬴.","Sobe na M nivoima prakti캜no nemaju dnevnog svetla jer su prakti캜no ukopane, pa bi to trebalo da stoji u opisu. Nama nije preterano smetalo jer smo u hotelu samo prespavali.",9,"Lokacija odli캜na, odmah pored reke. Moderno ure캠en hotel, krevet izuzetno udoban. Doru캜ak odli캜an, osoblje izuzetno ljubazno. Bezbedan parking u podzemnoj gara쬴. Sobe na M nivoima prakti캜no nemaju dnevnog svetla jer su prakti캜no ukopane, pa bi to trebalo da stoji u opisu. Nama nije preterano smetalo jer smo u hotelu samo prespavali."
"Mali hotel,to se ne primecuje......veoma 
dobra organizacija....preporuka je za sve posete Beograda u centru oko reke Save",,10,"Mali hotel,to se ne primecuje......veoma 
dobra organizacija....preporuka je za sve posete Beograda u centru oko reke Save "
"Veoma lep mali hotel, super doru캜ak kao i restoran.","Soba sa terasom bez dnevne svetlosti, ose캖ala sam se kao u podrumu. Mozda ne bi bilo lo코e naglasiti to negde pre rezervacije.",8,"Veoma lep mali hotel, super doru캜ak kao i restoran. Soba sa terasom bez dnevne svetlosti, ose캖ala sam se kao u podrumu. Mozda ne bi bilo lo코e naglasiti to negde pre rezervacije."
"Lokacija, ulaz u parking, mir, 캜isto캖a, blizina centra, blizina auto-puta, blizina reke i 코etali코ta",Nemam zamerku,10,"Lokacija, ulaz u parking, mir, 캜isto캖a, blizina centra, blizina auto-puta, blizina reke i 코etali코ta Nemam zamerku"
"krevet kao na oblacima da sam spavao, lokacija odlicna 游녧游낗",,10,"krevet kao na oblacima da sam spavao, lokacija odlicna 游녧游낗 "
odli캜na lokacija. 캜ist objekat. izuzetno ljubazno osoblje.,,10,odli캜na lokacija. 캜ist objekat. izuzetno ljubazno osoblje. 
,Soba je hladna...nije mogla da se zagreje,8, Soba je hladna...nije mogla da se zagreje
Bilo je 캜isto,"Nije dovoljno ljubazno osoblje,trazila sam da mi pomognu oko TV i daljinskog,odbili su moju molbu",5,"Bilo je 캜isto Nije dovoljno ljubazno osoblje,trazila sam da mi pomognu oko TV i daljinskog,odbili su moju molbu"
Nista najgore mjesto na koje sam ikad posjetio,"Soba u kojj sam bio nema prirodnu svjetlost nasprem terase je zid u tunelu  ste. Coca cola u mini baru istekao rok. Rezervisa sam dvije sobe ispostavilo se da jedna nema dorucak i onda je naplacem iako od nas cetvero dvoje nije bilo na dorucku, al kako rekose iz pogresne sobe. Konobarica sa frckavom kosom nevjerobatno neljubazna, kolega konobar nas je cak vrjedjao, a brkati recepcioner nije se ni potrudio odgovoriti na nase primjedbe vec je dodatno bio neprijatan. Jos sam u soku da ovakvi uposleni postoje...",1,"Nista najgore mjesto na koje sam ikad posjetio Soba u kojj sam bio nema prirodnu svjetlost nasprem terase je zid u tunelu  ste. Coca cola u mini baru istekao rok. Rezervisa sam dvije sobe ispostavilo se da jedna nema dorucak i onda je naplacem iako od nas cetvero dvoje nije bilo na dorucku, al kako rekose iz pogresne sobe. Konobarica sa frckavom kosom nevjerobatno neljubazna, kolega konobar nas je cak vrjedjao, a brkati recepcioner nije se ni potrudio odgovoriti na nase primjedbe vec je dodatno bio neprijatan. Jos sam u soku da ovakvi uposleni postoje..."
"Apartmanot e prekrasno ureden, se e namesteno so vkus. Higienata na maksimalno mozno nivo, i moja preporaka za sekoj koj saka da se prosheta niz Belgrad a na krajot od denot da se odmori vo tishina. Igor i Marija se prekrasni i stojat na raspolaganje na nivnite gosti vo sekoj moment.
Bravo, Bravo, Bravo !!!","Tolku e se dobro, shto ako e podobro nema da cini :))))",10,"Apartmanot e prekrasno ureden, se e namesteno so vkus. Higienata na maksimalno mozno nivo, i moja preporaka za sekoj koj saka da se prosheta niz Belgrad a na krajot od denot da se odmori vo tishina. Igor i Marija se prekrasni i stojat na raspolaganje na nivnite gosti vo sekoj moment.
Bravo, Bravo, Bravo !!! Tolku e se dobro, shto ako e podobro nema da cini :))))"
Vlasnici apartmana su izuzetno ljubazni ljudi. Sve je 캜isto i uredno. Rado se vra캖amo ponovo,,10,Vlasnici apartmana su izuzetno ljubazni ljudi. Sve je 캜isto i uredno. Rado se vra캖amo ponovo 
"Lokacija idealna, domacini ljubazni, objekat prijatan i veoma cist . Na samo minut hoda od bulevara. Ponovo bi smo se vratili.",,10,"Lokacija idealna, domacini ljubazni, objekat prijatan i veoma cist . Na samo minut hoda od bulevara. Ponovo bi smo se vratili. "
Sve pohvale za domacine. Srda캜an do캜ek.. 캛ist apartman topao sve na mestu za odmor. Svaka preporuka za ovaj apartman.,/,10,Sve pohvale za domacine. Srda캜an do캜ek.. 캛ist apartman topao sve na mestu za odmor. Svaka preporuka za ovaj apartman. /
"Perfektan apartman, cist i super opremljen,  ljudi koji izdaju su  jako ljubazni! Za svaku preporuku 游녧

Perfect accommodation,  very clean and well equipped. Host's are very polite and friendly. All recommendations 驕쥞잺游녧",,10,"Perfektan apartman, cist i super opremljen,  ljudi koji izdaju su  jako ljubazni! Za svaku preporuku 游녧

Perfect accommodation,  very clean and well equipped. Host's are very polite and friendly. All recommendations 驕쥞잺游녧 "
뤯쥃쮏햦햫햟 혲햣 쒫왏쮏쨿 햢쮏쐄햟 햦 혝햦혠햟. 햅햟향햢햟 혲햣 혝햟햨쮐뉋 쒫왏쮏쨿 햣햫혝혞향햦혲햟혜혝햦혢햟햫 햦 쮏쨿썛웷 햫햟햪~,,10,뤯쥃쮏햦햫햟 혲햣 쒫왏쮏쨿 햢쮏쐄햟 햦 혝햦혠햟. 햅햟향햢햟 혲햣 혝햟햨쮐뉋 쒫왏쮏쨿 햣햫혝혞향햦혲햟혜혝햦혢햟햫 햦 쮏쨿썛웷 햫햟햪~ 
"Sve pohvale za doma캖ine koji su bili izuzetno prijatni i ljubazni. Sto se tice apartmana, sve je u potpunosti savrseno, nemam apsolutno ni jednu primedbu. Svaka preporuka!",,10,"Sve pohvale za doma캖ine koji su bili izuzetno prijatni i ljubazni. Sto se tice apartmana, sve je u potpunosti savrseno, nemam apsolutno ni jednu primedbu. Svaka preporuka! "
"Fenomenalna lokacija, veoma ljubazno osoblje, izuzetno cist i lep hotel, sve preporuke i pohvale...sigurno cu ga opet posetiti",,10,"Fenomenalna lokacija, veoma ljubazno osoblje, izuzetno cist i lep hotel, sve preporuke i pohvale...sigurno cu ga opet posetiti "
"Hotel se nalazi na odlicnoj lokaciji , apartman je bio uredan.","U apartmanu uopste nije radio tv , to mi je bas smetalo",8,"Hotel se nalazi na odlicnoj lokaciji , apartman je bio uredan. U apartmanu uopste nije radio tv , to mi je bas smetalo"
"Prijatno osoblje, i udoban smestaj cisto i sve utegnuto kako treba.","Lokacija, smestaj osoblje recepcija koja je na usluzi 24h. Jako ljubazni i gostoprimljivi..",8,"Prijatno osoblje, i udoban smestaj cisto i sve utegnuto kako treba. Lokacija, smestaj osoblje recepcija koja je na usluzi 24h. Jako ljubazni i gostoprimljivi.."
"Odli캜na lokacija, strogi centar, 7 minuta laganog hoda od Studentskog trga, izuzetno ljubazno osoblje, mir i ti코ina. Hotel ima i svoj parking u neposrednoj blizini, 코to je jako bitno u centru Beograda. Apartman sa hidromasa쬹om kadom je izuzetan.","Parking bi za goste mogao biti jeftiniji. Hotel nema mogu캖nost doru캜ka, 코to i nije neki nedostatak, ali eto, da napomenem.",9,"Odli캜na lokacija, strogi centar, 7 minuta laganog hoda od Studentskog trga, izuzetno ljubazno osoblje, mir i ti코ina. Hotel ima i svoj parking u neposrednoj blizini, 코to je jako bitno u centru Beograda. Apartman sa hidromasa쬹om kadom je izuzetan. Parking bi za goste mogao biti jeftiniji. Hotel nema mogu캖nost doru캜ka, 코to i nije neki nedostatak, ali eto, da napomenem."
Sve je ekstra !,Nema toga...,10,Sve je ekstra ! Nema toga...
Rezervisao sam sobu od 26 kvadrata bila je mnogo manja. Jakuzi komplikovan. Osoblje vi코e nego ljubazno.,"Jakuzi komplikovan,soba manja nego sto sam rezervisao.",8,"Rezervisao sam sobu od 26 kvadrata bila je mnogo manja. Jakuzi komplikovan. Osoblje vi코e nego ljubazno. Jakuzi komplikovan,soba manja nego sto sam rezervisao."
"Sve pohvale za recepciju hotela, a nsrocito za Majkla",Sto nema sobe za pusace u sklopu hotela,10,"Sve pohvale za recepciju hotela, a nsrocito za Majkla Sto nema sobe za pusace u sklopu hotela"
"Osoblje je preljubazno, platili su mi parking, pozvali taxi kad sam trebao, 10+++",,10,"Osoblje je preljubazno, platili su mi parking, pozvali taxi kad sam trebao, 10+++ "
Lokacija je dobra.,Jastuci su previ코e tvrdi i to nam se jedino nije svidjelo.,9,Lokacija je dobra. Jastuci su previ코e tvrdi i to nam se jedino nije svidjelo.
Cisto i udobno...,,10,Cisto i udobno... 
"Lokacija odlicna,sobe prelepe,osoblje jako ljubazno,sve pohvale.",,10,"Lokacija odlicna,sobe prelepe,osoblje jako ljubazno,sve pohvale. "
"Hotel je na odli캜noj lokaciji. Jako blizu centra, a tiho i mirno. Osoblje je divno, sobe su 캜iste. Prezadovoljni smo!",,10,"Hotel je na odli캜noj lokaciji. Jako blizu centra, a tiho i mirno. Osoblje je divno, sobe su 캜iste. Prezadovoljni smo! "
"Sve je bilo super. Osoblje odlicno, komunikativno uvek vam na raspolaganju. Sobe ciste. Lokacija odlicna. Parking blizu i pokriven video nadzorom.",,10,"Sve je bilo super. Osoblje odlicno, komunikativno uvek vam na raspolaganju. Sobe ciste. Lokacija odlicna. Parking blizu i pokriven video nadzorom. "
"Sve je super, soba, osoblje, lokacijaa. Cista preporuka. Opet se planiram vratiti u isti hotel kada budem dolazio u BG",,10,"Sve je super, soba, osoblje, lokacijaa. Cista preporuka. Opet se planiram vratiti u isti hotel kada budem dolazio u BG "
Sve je pefektno.,,10,Sve je pefektno. 
"Hotel na izvanrednoj lokaciji, na par minuta hoda od centra grada. Osoblje profesionalno i veoma ljubazno. Sobe 캜iste, a kreveti udobni.
Sigurno dolazimo opet! :)",,10,"Hotel na izvanrednoj lokaciji, na par minuta hoda od centra grada. Osoblje profesionalno i veoma ljubazno. Sobe 캜iste, a kreveti udobni.
Sigurno dolazimo opet! :) "
"Udoban hotel, na super lokaciji.",,10,"Udoban hotel, na super lokaciji. "
"Odlican hotel, na super lokaciji, ciste i lepo uredjene sobe, ljubazno osoblje. Za svaku preporuku.",,10,"Odlican hotel, na super lokaciji, ciste i lepo uredjene sobe, ljubazno osoblje. Za svaku preporuku. "
"Ambijent, usluga, osoblje, lokacija, apsolutno sve je vi코e nego odli캜no! Sve preporuke!",,10,"Ambijent, usluga, osoblje, lokacija, apsolutno sve je vi코e nego odli캜no! Sve preporuke! "
"Sjajan hotel, na odlicnoj lokaciji, fenomenalna usluga, sobe su prostrane ciste i luksuzno opremljene",,10,"Sjajan hotel, na odlicnoj lokaciji, fenomenalna usluga, sobe su prostrane ciste i luksuzno opremljene "
ljubazno osoblje I predivna soba :),,10,ljubazno osoblje I predivna soba :) 
"Fantastican hotel, odlicna lokacija, ljubazno osoblje, sobe su prostrane, luksuzno opremljene, kreveti jako udobni, sve u svemu, hotel za svaku preporuku",,10,"Fantastican hotel, odlicna lokacija, ljubazno osoblje, sobe su prostrane, luksuzno opremljene, kreveti jako udobni, sve u svemu, hotel za svaku preporuku "
"Osoblje izuzetno prijatno i predusretljivo.
Odli캜na lokacija,sve 코to vam je potrebno je u blizini.
Za svaku preporuku.",,10,"Osoblje izuzetno prijatno i predusretljivo.
Odli캜na lokacija,sve 코to vam je potrebno je u blizini.
Za svaku preporuku. "
"Suprug i ja smo prezadovoljni lokacijom, osobljem i uslugom!
Sobe su 캜iste, uredne i jako lepo sre캠ene! 
Smatram da je odnos cene i kvaliteta i vi코e nego odli캜an!
Svima bih Vas preporu캜ila!
Do slede캖eg vi캠anja, 
Srda캜no, Andrijana!",,10,"Suprug i ja smo prezadovoljni lokacijom, osobljem i uslugom!
Sobe su 캜iste, uredne i jako lepo sre캠ene! 
Smatram da je odnos cene i kvaliteta i vi코e nego odli캜an!
Svima bih Vas preporu캜ila!
Do slede캖eg vi캠anja, 
Srda캜no, Andrijana! "
"Pre svega ljubazno osoblje, zatim naravno soba koja je savrseno uredna, cista, lepo osmisljenih detalja.
Izdvojila bih za sebe najbitniju stavku, bela posteljina.",Ne postoji nesto sto mi se nije dopalo.,10,"Pre svega ljubazno osoblje, zatim naravno soba koja je savrseno uredna, cista, lepo osmisljenih detalja.
Izdvojila bih za sebe najbitniju stavku, bela posteljina. Ne postoji nesto sto mi se nije dopalo."
Lokacija je super.,"Na zidovima iznad prozora, a ispod zavesa, se vide crne fleke od kondenzacije.",8,"Lokacija je super. Na zidovima iznad prozora, a ispod zavesa, se vide crne fleke od kondenzacije."
Sve je ok,Buka od renoviranja okolnog objekta,9,Sve je ok Buka od renoviranja okolnog objekta
캟akuzi,,10,캟akuzi 
,"Nestalo je struje u hotelu a njihovi domacini uopste nisu se potrudili da mi pomognu iako sam im preneo da imam krstenje, da treba da se popeglaju kosulje, za bebu treba toplo mleko, sredjivanje frizure i dosta drugih stvar. Iako za  sam nestanak struje nisu oni krivi, nisu se nimalo ponudili da mi pomognu da resim problem.
Iako sam loyalan njihov klijent dobio sam vrlo negativno iskustvo. Hotel je odlican ali sam odnos zaposlenih nije na zadovoljavajucem nivou.
Iako sam vise puta dolazio u hotel koji mi se jako svideo, zbog ovakvog odnosa zaposlenih necu vise dolaziti",5," Nestalo je struje u hotelu a njihovi domacini uopste nisu se potrudili da mi pomognu iako sam im preneo da imam krstenje, da treba da se popeglaju kosulje, za bebu treba toplo mleko, sredjivanje frizure i dosta drugih stvar. Iako za  sam nestanak struje nisu oni krivi, nisu se nimalo ponudili da mi pomognu da resim problem.
Iako sam loyalan njihov klijent dobio sam vrlo negativno iskustvo. Hotel je odlican ali sam odnos zaposlenih nije na zadovoljavajucem nivou.
Iako sam vise puta dolazio u hotel koji mi se jako svideo, zbog ovakvog odnosa zaposlenih necu vise dolaziti"
"Jacuzzi, sadr쬬j sobe","Objekt se reklamira sa parkingom. Parking nije adekvatan jer je to zapravo dvori코te koje je pod klju캜em, tako da pri dolasku morate prvo stati pred hotel, a da pri tome nema mjesta da stanete, te se nalazi u neposrednoj blizini. Kod odlaska uzmete kljuc istog tog parkinga, otklju캜ate te izre쬰te auto iz dvori코ta, te bi onda taj isti kljuc trebali vratiti na recepciju hotela, umjesto da to za vas napravi osoblje. I nije bas najbolje rje코enje. Wc 코koljka je bila zmazana.",4,"Jacuzzi, sadr쬬j sobe Objekt se reklamira sa parkingom. Parking nije adekvatan jer je to zapravo dvori코te koje je pod klju캜em, tako da pri dolasku morate prvo stati pred hotel, a da pri tome nema mjesta da stanete, te se nalazi u neposrednoj blizini. Kod odlaska uzmete kljuc istog tog parkinga, otklju캜ate te izre쬰te auto iz dvori코ta, te bi onda taj isti kljuc trebali vratiti na recepciju hotela, umjesto da to za vas napravi osoblje. I nije bas najbolje rje코enje. Wc 코koljka je bila zmazana."
lokacija,odnos dela osoblja prema gostu,5,lokacija odnos dela osoblja prema gostu
"preskup , nista ne nude ! nikako 4 zvezdice !!
imapuno boljih u Bgd i jeftinije","skup , jedna cena na Booking.com a veca kad platis kod njih! nije vredno",5,"preskup , nista ne nude ! nikako 4 zvezdice !!
imapuno boljih u Bgd i jeftinije skup , jedna cena na Booking.com a veca kad platis kod njih! nije vredno"
,Nedostaje doru캜ak,9, Nedostaje doru캜ak
"Sve je bilo super!
Veoma ljubazni doma캖ini. Uz malu nadoknadu mogu da dovedem i psa.",,10,"Sve je bilo super!
Veoma ljubazni doma캖ini. Uz malu nadoknadu mogu da dovedem i psa. "
"Sve je bilo odli캜no. 캛isto, prostrano, udobno. Vrati캖emo se ponovo nekom prilikom!",,10,"Sve je bilo odli캜no. 캛isto, prostrano, udobno. Vrati캖emo se ponovo nekom prilikom! "
"Sirok izbor za dorucak. Na dohvat ruke pekara, restoran domace hrane, prodavnica i piljara. Odlicna lokacija. Lep i veliki stan, dobro opremljen. Miran kraj. Veoma smo zadovoljni!",,10,"Sirok izbor za dorucak. Na dohvat ruke pekara, restoran domace hrane, prodavnica i piljara. Odlicna lokacija. Lep i veliki stan, dobro opremljen. Miran kraj. Veoma smo zadovoljni! "
Prostrano je i cisto.,,10,Prostrano je i cisto. 
"Apartman je prostran, 캜ist i lepo opremljen. Kreveti su veoma udobni, kuhinja u potpunosti opremljena. Kraj u kome se nalazi je miran i mesto je idealno za odmor. Do aerodroma treba manje od 10 minuta 코to mi je mnogo zna캜ilo. Doma캖ini su veoma ljubazni! 游",,10,"Apartman je prostran, 캜ist i lepo opremljen. Kreveti su veoma udobni, kuhinja u potpunosti opremljena. Kraj u kome se nalazi je miran i mesto je idealno za odmor. Do aerodroma treba manje od 10 minuta 코to mi je mnogo zna캜ilo. Doma캖ini su veoma ljubazni! 游 "
"Lokacija u blizini auto-puta, sve je uredno i 캜isto. Stan je prostran i udoban, siguran parking u dvori코tu sa video nadzorom. Mnogo slobodnog prostora napolju za decu. Ljubazni doma캖ini! Lepa terasa za u쬴vanje u jutarnjoj kafi!",,10,"Lokacija u blizini auto-puta, sve je uredno i 캜isto. Stan je prostran i udoban, siguran parking u dvori코tu sa video nadzorom. Mnogo slobodnog prostora napolju za decu. Ljubazni doma캖ini! Lepa terasa za u쬴vanje u jutarnjoj kafi! "
Hotel je na dobroj lokaciji..Sve je uredno..캜isto..a osoblje preljubazno,Sve je u redu,10,Hotel je na dobroj lokaciji..Sve je uredno..캜isto..a osoblje preljubazno Sve je u redu
"Izvanredna lokacija,캘isto캖a na zavidnom nivou a osoblje i vise nego kvalifikovano i ljubazno..,Topla preporuka za bilo koju vrstui boravka!",,10,"Izvanredna lokacija,캘isto캖a na zavidnom nivou a osoblje i vise nego kvalifikovano i ljubazno..,Topla preporuka za bilo koju vrstui boravka! "
"Prelijepe velike i uredne sobe.,parking u sklopu hotela.Odli캜na pozicija hotela",,10,"Prelijepe velike i uredne sobe.,parking u sklopu hotela.Odli캜na pozicija hotela "
Sve je bilo odli캜no. Super lokacija...najva쬹ije je 코to ima besplatni parking. Osoblje je veoma prijatno i od velike pomo캜i,"40 ekstra na ra캜unu ako 쬰lite da u캠ete u sobu prije 14 sati kad po캜inje 캜ekiranje. Osim toga,nema ni코ta negativno",10,"Sve je bilo odli캜no. Super lokacija...najva쬹ije je 코to ima besplatni parking. Osoblje je veoma prijatno i od velike pomo캜i 40 ekstra na ra캜unu ako 쬰lite da u캠ete u sobu prije 14 sati kad po캜inje 캜ekiranje. Osim toga,nema ni코ta negativno"
"Prijatan ambijent, lepe sobe,ljubazno osoblje i fantasti캜an maser Milos.",,9,"Prijatan ambijent, lepe sobe,ljubazno osoblje i fantasti캜an maser Milos. "
"Veoma prijatan boravak, sa ljubaznim osobljem. Predivan novi hotel, na dobroj lokaciji, sa moderno opremljenim sobama. Posebna pohvala za recepcionerku iz Budve, jedan veliki profesionalac, veoma ljubazna i sposobna mlada osoba.",,10,"Veoma prijatan boravak, sa ljubaznim osobljem. Predivan novi hotel, na dobroj lokaciji, sa moderno opremljenim sobama. Posebna pohvala za recepcionerku iz Budve, jedan veliki profesionalac, veoma ljubazna i sposobna mlada osoba. "
"Lokacija hotela odli캜na,doru캜ak korektan,hotel moderno opremljen izuzetno 캜ist,parking obezbe캠en.
Toplo preporu캜ujem Sky Hotel.",Nisam imala zamerke za kratko vreme koje sam provela u hotelu.,10,"Lokacija hotela odli캜na,doru캜ak korektan,hotel moderno opremljen izuzetno 캜ist,parking obezbe캠en.
Toplo preporu캜ujem Sky Hotel. Nisam imala zamerke za kratko vreme koje sam provela u hotelu."
"Lijepo ure캠en hotel, profesionalno i izuzetno prijatno osoblje za svaku pohvalu, ugodna atmosefera, doru캜ak izvrstan, svje i raznovrstan, parking obezbije캠en, lift, klima odli캜na, unutra코nji hodnici svijetli i prozra캜ni,hotel lokacija u samom centru u mirnoj ulici.",Stakleni wc je jako lo코e rje코enje. Osjeti se neugodan miris bu캠i u tu코 kabini. I neugodan je miris pe코kira. U ormaru samo dva ofingera.,10,"Lijepo ure캠en hotel, profesionalno i izuzetno prijatno osoblje za svaku pohvalu, ugodna atmosefera, doru캜ak izvrstan, svje i raznovrstan, parking obezbije캠en, lift, klima odli캜na, unutra코nji hodnici svijetli i prozra캜ni,hotel lokacija u samom centru u mirnoj ulici. Stakleni wc je jako lo코e rje코enje. Osjeti se neugodan miris bu캠i u tu코 kabini. I neugodan je miris pe코kira. U ormaru samo dva ofingera."
"Sve je bilo savr코eno!
Hotel je odli캜an, blizu centra.
Besplatan parking.
Osoblje izuzetno ljubazno!",,10,"Sve je bilo savr코eno!
Hotel je odli캜an, blizu centra.
Besplatan parking.
Osoblje izuzetno ljubazno! "
"Hotel se nalazi na odlicnoj lokaciji.ima parking,ciste sobe,solidan doru캜ak sigurno cu se vratiti ponovo 游",Grejanje u sobi.,8,"Hotel se nalazi na odlicnoj lokaciji.ima parking,ciste sobe,solidan doru캜ak sigurno cu se vratiti ponovo 游 Grejanje u sobi."
"Lijep hotel, ljubazno osoblje.",Lo코 doru캜ak...,8,"Lijep hotel, ljubazno osoblje. Lo코 doru캜ak..."
"Lokacija je 游똂,osoblje top.",,10,"Lokacija je 游똂,osoblje top. "
SVe je bilo super ... nema sta,nista,10,SVe je bilo super ... nema sta nista
"Porodi캜na soba prostrana, 캜ista!
Iako su vani bile vru캖ine, u sobi jako prijatno!
Parking!",,9,"Porodi캜na soba prostrana, 캜ista!
Iako su vani bile vru캖ine, u sobi jako prijatno!
Parking! "
Samo prking,Kljma u hodniku i malo kupatilo,1,Samo prking Kljma u hodniku i malo kupatilo
Mnogo lijep hotel sa izvrsnim osobljem,,10,Mnogo lijep hotel sa izvrsnim osobljem 
"Udobnost, krevet je bio top! Dorucak vrhunski! Kupatilo prostrano i cisto!",,10,"Udobnost, krevet je bio top! Dorucak vrhunski! Kupatilo prostrano i cisto! "
lokacija dobra i odlican dorucak,nista,9,lokacija dobra i odlican dorucak nista
Sve.,/,10,Sve. /
"Dobra lokacija, 캜isto, uredno, vrijedno osoblje, raznovrsna doru캜ak, sve je bilo ok.",,10,"Dobra lokacija, 캜isto, uredno, vrijedno osoblje, raznovrsna doru캜ak, sve je bilo ok. "
"Dorucak raznovrstan i ukusan, lokacija odlicna.","Losa izolacija, sva buka sa hodnika se cula u sobi",9,"Dorucak raznovrstan i ukusan, lokacija odlicna. Losa izolacija, sva buka sa hodnika se cula u sobi"
"Hotel je zaista 캜ist, osoblje jako ljubazno! Lokacija savrsena! Od sada je hotel Nobel moja destinacija kada dodjem u Beograd.","Imam sugestiju samo za doru캜ak, mozda bi migao da bude prilagodjen osobama koje ne jedu gluten ili beli hleb, malo vise voca i povrca. Ostalo je odli캜no!",10,"Hotel je zaista 캜ist, osoblje jako ljubazno! Lokacija savrsena! Od sada je hotel Nobel moja destinacija kada dodjem u Beograd. Imam sugestiju samo za doru캜ak, mozda bi migao da bude prilagodjen osobama koje ne jedu gluten ili beli hleb, malo vise voca i povrca. Ostalo je odli캜no!"
"Osoblje izuzetno uslu쬹o, nasmejano, vedro. Doru캜ak sasvim zadovoljava potrebe, raznovrstan.","Kreveti su malo mek코i, ali to nije pokvarilo utisak.",8,"Osoblje izuzetno uslu쬹o, nasmejano, vedro. Doru캜ak sasvim zadovoljava potrebe, raznovrstan. Kreveti su malo mek코i, ali to nije pokvarilo utisak."
Bilo je preljepo. Osobjle sa recepcija predivno. Hotel cist i uredan. Dorucak je bio odlican. 游봃,,10,Bilo je preljepo. Osobjle sa recepcija predivno. Hotel cist i uredan. Dorucak je bio odlican. 游봃 
parking,맚onse pla캖a,10,parking 맚onse pla캖a
"Kao i uvek do sada osoblje divno, lokacija ,cistoca, dorucak takodje...medjutim dobili smo sobu sa vlagom u toaletu sto je pokvarilo utisak.  Verujem da je to izuzetak ali ima prostora za ulaganje. 
Fotografija u prilogu.",,8,"Kao i uvek do sada osoblje divno, lokacija ,cistoca, dorucak takodje...medjutim dobili smo sobu sa vlagom u toaletu sto je pokvarilo utisak.  Verujem da je to izuzetak ali ima prostora za ulaganje. 
Fotografija u prilogu. "
Super je sve,,10,Super je sve 
"Blizina grada,cistoca",U restoranu neljubaznost radnice koja je iz Loznice rodom toliko znamo o njoj.,9,"Blizina grada,cistoca U restoranu neljubaznost radnice koja je iz Loznice rodom toliko znamo o njoj."
"Enterijer, lokacija, ljubazno osoblje",,10,"Enterijer, lokacija, ljubazno osoblje "
Lokacija,,10,Lokacija 
