positive,negative,rating,comments
"dobra lokacija, udobno, lepo, cisto..","Domacin, pre svega neodgovoran. Rezervisem smestaj pre sedan dana, na dan prijave kaze da ne mogu ostati tu i da trazim drugi smestaj. Dva puta me je ispalio.. razlog, neko vec privatno rezervisao, a drugi put je vec naveo da su neki rusi produzili boravak jos 15 dana i da mu se ne isplati na dan da iznajmljuje, plus imam popust koji njemu ne odgovara..",9,"dobra lokacija, udobno, lepo, cisto.. Domacin, pre svega neodgovoran. Rezervisem smestaj pre sedan dana, na dan prijave kaze da ne mogu ostati tu i da trazim drugi smestaj. Dva puta me je ispalio.. razlog, neko vec privatno rezervisao, a drugi put je vec naveo da su neki rusi produzili boravak jos 15 dana i da mu se ne isplati na dan da iznajmljuje, plus imam popust koji njemu ne odgovara.."
,Nije nam se dopalo sto nas je vlasnik izme코tao nakom bukiranja i to 2 puta,1, Nije nam se dopalo sto nas je vlasnik izme코tao nakom bukiranja i to 2 puta
" Simpati캜an apartman na dobroj lokaciji
 Vrlo lak check in"," 캛isto캖a bi mogla biti na vi코em nivou
 Apartman je okrenut ka vrlo prometnoj ulici pa je buka poprili캜na",6," Simpati캜an apartman na dobroj lokaciji
 Vrlo lak check in  캛isto캖a bi mogla biti na vi코em nivou
 Apartman je okrenut ka vrlo prometnoj ulici pa je buka poprili캜na"
,"Sme코taj smo rezervisali 10ak dana ranije i dogovorili se sa vlasnikom da ga pozovemo kada stignemo da nam preda klju캜eve. Kad smo stigli ispred sme코taja pozvali smo vlasnika da nam da klju캜, ali nam je on saop코tio da apartman nije slobodan, uz izmi코ljenu pri캜u da je pukla cev, bez volje da nam  ponudi re코enje za svoj propust. Tako캠e, rekao je da je dan ranije poslao poruku da apartman ne캖e biti slobodan, ali ta poruka nikada nije stigla. Zbog svega toga smo posumnjali u njegovu pri캜u o cevi. Valjda je normalno da kada se tako ne코to desi, pozove코 ljude, ka쬰코 코ta je problem i u znak izvinjenja pomogne코 u pronalasku novog sme코taja. Vlasnik je o캜igledno izbegavao razgovor zbog svojih la쬴.",1," Sme코taj smo rezervisali 10ak dana ranije i dogovorili se sa vlasnikom da ga pozovemo kada stignemo da nam preda klju캜eve. Kad smo stigli ispred sme코taja pozvali smo vlasnika da nam da klju캜, ali nam je on saop코tio da apartman nije slobodan, uz izmi코ljenu pri캜u da je pukla cev, bez volje da nam  ponudi re코enje za svoj propust. Tako캠e, rekao je da je dan ranije poslao poruku da apartman ne캖e biti slobodan, ali ta poruka nikada nije stigla. Zbog svega toga smo posumnjali u njegovu pri캜u o cevi. Valjda je normalno da kada se tako ne코to desi, pozove코 ljude, ka쬰코 코ta je problem i u znak izvinjenja pomogne코 u pronalasku novog sme코taja. Vlasnik je o캜igledno izbegavao razgovor zbog svojih la쬴."
,"Nismo ni boravili jer je krajnje neprofesionalno bilo sa doma캖inove strane da ceo dan 캜ekamo da nam se javi gde da preuzmemo klju캜eve i kada, odbijanje poziva, da bi na kraju ve캜e pred polazak u 21:30h dobili SMS poruku kako je do코lo do gre코ke i preklapanja datuma i da apartman nije dostupan.",4," Nismo ni boravili jer je krajnje neprofesionalno bilo sa doma캖inove strane da ceo dan 캜ekamo da nam se javi gde da preuzmemo klju캜eve i kada, odbijanje poziva, da bi na kraju ve캜e pred polazak u 21:30h dobili SMS poruku kako je do코lo do gre코ke i preklapanja datuma i da apartman nije dostupan."
Osoblje je profesionalno i jako ljubazno.Apartmani su komforni i udobni.Lokacija je odlicna.Sve preporuke.,,10,Osoblje je profesionalno i jako ljubazno.Apartmani su komforni i udobni.Lokacija je odlicna.Sve preporuke. 
"Osoblje je izuzetno prijatno, smestaj 캜ist sa lepo uredjenim prostorom!
Voda u bazenu izuzetno topla i cista!
Sve u svemu, sve pohvale!",,10,"Osoblje je izuzetno prijatno, smestaj 캜ist sa lepo uredjenim prostorom!
Voda u bazenu izuzetno topla i cista!
Sve u svemu, sve pohvale! "
"Nas apartman i celo osoblje je bilo izuzetno ljubazno, hrana je odlicna! Konobari u restoranu su bili takodje jako ljubazni! Hotel zaista opravdava ime! Sve preporuke i radujemo se sledecem dolasku!",,10,"Nas apartman i celo osoblje je bilo izuzetno ljubazno, hrana je odlicna! Konobari u restoranu su bili takodje jako ljubazni! Hotel zaista opravdava ime! Sve preporuke i radujemo se sledecem dolasku! "
Sve je prelepo i osoblje ljubazno. Sve preporuke 鮫봺잺,,10,Sve je prelepo i osoblje ljubazno. Sve preporuke 鮫봺잺 
Sve je bilo sjajno!!,,10,Sve je bilo sjajno!! 
"Apartman je bio ekstra, pogled na planine! Svaki dan su cistili sobu. Bazen 캜ist, topla voda! Doru캜ak fenomenalno! Zatvoreni parking. Sve preporuka!",Sef nije radio.,10,"Apartman je bio ekstra, pogled na planine! Svaki dan su cistili sobu. Bazen 캜ist, topla voda! Doru캜ak fenomenalno! Zatvoreni parking. Sve preporuka! Sef nije radio."
"Prelepo, cisto i odlicno osoblje...",,10,"Prelepo, cisto i odlicno osoblje... "
"Sve!
Apartman je izuzetno cist,prelepo ure캠en, osvetljen, dorucak fantasti캜an a osoblje profesionalno!",,10,"Sve!
Apartman je izuzetno cist,prelepo ure캠en, osvetljen, dorucak fantasti캜an a osoblje profesionalno! "
"Profesionalno odradjeno, uredjeno uz puno ukusa i funkcionalnosti,osoblje usluzno,dostupno,nasmejano,hrana raznovrsna,veoma cisto,lokacija odlicna,izdvojen od cemtra uirnom delu a ipak blizu svega .",,10,"Profesionalno odradjeno, uredjeno uz puno ukusa i funkcionalnosti,osoblje usluzno,dostupno,nasmejano,hrana raznovrsna,veoma cisto,lokacija odlicna,izdvojen od cemtra uirnom delu a ipak blizu svega . "
"Ozbiljna preporuka za ovo mesto. Dorucak 10/10, osoblje veoma ljubazno i prijatno! Cistoca apartmana na najvisem nivou, pohvala i za enterijer. Opcije spa i teretane takodje veliki plus za upotpuniti dan.
Radujem se ponovnoj poseti planini i smestaju na ovom mestu!",Parking 1000 rsd po danu :),10,"Ozbiljna preporuka za ovo mesto. Dorucak 10/10, osoblje veoma ljubazno i prijatno! Cistoca apartmana na najvisem nivou, pohvala i za enterijer. Opcije spa i teretane takodje veliki plus za upotpuniti dan.
Radujem se ponovnoj poseti planini i smestaju na ovom mestu! Parking 1000 rsd po danu :)"
"Objekat je prelep! Atmosfera je topla!
Osecaj kao da ste kod kuce!
Osoblje je preljubazno!
Svaka preporuka i jedva cekamo sledece druzenje!
P.S Playstation soba nas je odusevila iako smo velika 'deca'.",,10,"Objekat je prelep! Atmosfera je topla!
Osecaj kao da ste kod kuce!
Osoblje je preljubazno!
Svaka preporuka i jedva cekamo sledece druzenje!
P.S Playstation soba nas je odusevila iako smo velika 'deca'. "
"Sve pohvale za objekat .Osoblje divno,ljubazno i uvek na raspolaganju.Objekat jako lep sa komfornim apartmanima.Lokacija odlicna na 5 min hoda do centra.10 ka za sve",Sve je bilo dobro,10,"Sve pohvale za objekat .Osoblje divno,ljubazno i uvek na raspolaganju.Objekat jako lep sa komfornim apartmanima.Lokacija odlicna na 5 min hoda do centra.10 ka za sve Sve je bilo dobro"
"Usluga je fenomenalna, apartman prostran prelep sve novo i cisto, dorucak za svakoga po nesto, sve u svemu sve pohvale",,10,"Usluga je fenomenalna, apartman prostran prelep sve novo i cisto, dorucak za svakoga po nesto, sve u svemu sve pohvale "
"Apartman,fin, prostran...divno osoblje, doru캜ak za sva캜iji ukus,..SPA sa svim sadr쬬jima, masa쬰...sve novo i odlu캜no uklopljeno游뗵",Nema toga,10,"Apartman,fin, prostran...divno osoblje, doru캜ak za sva캜iji ukus,..SPA sa svim sadr쬬jima, masa쬰...sve novo i odlu캜no uklopljeno游뗵 Nema toga"
Sveeee,/,10,Sveeee /
Sve je bilo odli캜no.,U apartmanu sa dvije sobe nedostaju 코olje za 캜aj 코to nije zgodno za boravak porodice sa djecom.,10,Sve je bilo odli캜no. U apartmanu sa dvije sobe nedostaju 코olje za 캜aj 코to nije zgodno za boravak porodice sa djecom.
"Izuzetno lep i moderan objekat,apartman cist i prostran,sve vreme je radilo grejanje-sto je nama i trebalo iako je bio maj.",,9,"Izuzetno lep i moderan objekat,apartman cist i prostran,sve vreme je radilo grejanje-sto je nama i trebalo iako je bio maj. "
"Novi, udobni, prostrani i relativno dobro opremljeni apartmani sa odli캜nim wellnes centrom. Kreveti preudobni, 코irok izbor jastuka. Sasvim dovoljno parking mjesta pa i u gara쬴. Objekat smje코ten malo od centra na mirnoj lokaciji sa odli캜nim restoranom u prizemlju.","Doru캜ak je poprili캜no skroman, posebno izbor posne hrane. Prili캜no neo캜ekivano pa pomalo i razo캜aravaju캖e za Srbiju u vrijeme Velikog posta ali dobro, da se popraviti. Tako캠e pored hrane nisu ispisani nazivi jela 코to nije uobi캜ajeno a i to se lako  da popraviti. Sve u svemu sitni nedostaci.",9,"Novi, udobni, prostrani i relativno dobro opremljeni apartmani sa odli캜nim wellnes centrom. Kreveti preudobni, 코irok izbor jastuka. Sasvim dovoljno parking mjesta pa i u gara쬴. Objekat smje코ten malo od centra na mirnoj lokaciji sa odli캜nim restoranom u prizemlju. Doru캜ak je poprili캜no skroman, posebno izbor posne hrane. Prili캜no neo캜ekivano pa pomalo i razo캜aravaju캖e za Srbiju u vrijeme Velikog posta ali dobro, da se popraviti. Tako캠e pored hrane nisu ispisani nazivi jela 코to nije uobi캜ajeno a i to se lako  da popraviti. Sve u svemu sitni nedostaci."
"Sve je bilo prelepo. Osoblje, sme코taj, hrana, 캜isto...za svaku preporuku.",,10,"Sve je bilo prelepo. Osoblje, sme코taj, hrana, 캜isto...za svaku preporuku. "
"Po캜ev코i od osoblja, 캜isto캖e do hrane, sve je bilo izvanredno. Do캖i캖emo opet.",,10,"Po캜ev코i od osoblja, 캜isto캖e do hrane, sve je bilo izvanredno. Do캖i캖emo opet. "
"Hrana super. Slike na bookingu su projektne, ali sli캜no je i jako lijepo.",Bazen za djecu radi samo do 18캜. Nije pisalo nigdje prilikom rezervacije.,9,"Hrana super. Slike na bookingu su projektne, ali sli캜no je i jako lijepo. Bazen za djecu radi samo do 18캜. Nije pisalo nigdje prilikom rezervacije."
"Soba je bila super 캜ista, pe코kiri su menjani svakodnevno, pogled sa terase nam je bio prelep - gledali smo na borovu 코umu. Iako se nalazi maltene u samom centru grada, u hotelu je mirno i lepo se spava - kreveti su tako캠e udobni. Preporu캜ujem za porodice s decom, jer su moja deca u쬴vala u bazenu koji je mali, voda nam je bila sve vreme topla, a pogled iz bazena je na malo igrali코te u dvori코tu. Doru캜ak je raznovrstan, ima za sva캜iji ukus, osoblje je predusretljivo. Vrati캖emo se sigurno!",,10,"Soba je bila super 캜ista, pe코kiri su menjani svakodnevno, pogled sa terase nam je bio prelep - gledali smo na borovu 코umu. Iako se nalazi maltene u samom centru grada, u hotelu je mirno i lepo se spava - kreveti su tako캠e udobni. Preporu캜ujem za porodice s decom, jer su moja deca u쬴vala u bazenu koji je mali, voda nam je bila sve vreme topla, a pogled iz bazena je na malo igrali코te u dvori코tu. Doru캜ak je raznovrstan, ima za sva캜iji ukus, osoblje je predusretljivo. Vrati캖emo se sigurno! "
"Usluga, udobnost, hrana.","Mali bazen za toliki broj ljudi, naro캜ito 코to i odrasli i deca koriste isti. Ne po코tuje se da nakon 18h bazen i spa koriste odrasli.",10,"Usluga, udobnost, hrana. Mali bazen za toliki broj ljudi, naro캜ito 코to i odrasli i deca koriste isti. Ne po코tuje se da nakon 18h bazen i spa koriste odrasli."
Sobe su 캜iste....krevet udoban....lokacija hotela odlicna....parking perfektan...kupatilo sa podnim grejanjem pun pogodak,,10,Sobe su 캜iste....krevet udoban....lokacija hotela odlicna....parking perfektan...kupatilo sa podnim grejanjem pun pogodak 
"Moderne i lepo opremljene sobe,lokacija hotela i hrana u restoranu.","Mali spa centar,hladnija voda u bazenu.",9,"Moderne i lepo opremljene sobe,lokacija hotela i hrana u restoranu. Mali spa centar,hladnija voda u bazenu."
Korektnos i predivna usluga,콯al 코to bazen nije bio u funkciju.,8,Korektnos i predivna usluga 콯al 코to bazen nije bio u funkciju.
"Sve, hotel, lokacija, sadrzaji, cena",Bukvalno nista.,9,"Sve, hotel, lokacija, sadrzaji, cena Bukvalno nista."
"Sve je bilo perfektno! Od dolaska pa do polaska. Hrana obilna, raznovrsna i ukusna.Osoblje prijatno i ljubazno.",,10,"Sve je bilo perfektno! Od dolaska pa do polaska. Hrana obilna, raznovrsna i ukusna.Osoblje prijatno i ljubazno. "
"Odlican apartman, cisto, udobno. Sa svim sadrzajima kao kod kuce. Lokacija mirna u blizini centra. 5min pesaka. Bazen sa prijatnom vodom, ali je potrebno ulaganje u deking oko bazena obzirom da su daske u losem stanju. I prateci sadrzaji sauna, slana soba nisu bile u funkciji. Dorucak odlican.","Potrebno ulaganje u bazen i spa. Nisu u katastrofalnom stanju, ali nisu ni sjajni.",9,"Odlican apartman, cisto, udobno. Sa svim sadrzajima kao kod kuce. Lokacija mirna u blizini centra. 5min pesaka. Bazen sa prijatnom vodom, ali je potrebno ulaganje u deking oko bazena obzirom da su daske u losem stanju. I prateci sadrzaji sauna, slana soba nisu bile u funkciji. Dorucak odlican. Potrebno ulaganje u bazen i spa. Nisu u katastrofalnom stanju, ali nisu ni sjajni."
Hotel je stvarno jedan od boljih hotela na Zlatiboru. Osoblje profesionalno. Soba uredna i 캜ista. Sadr쬬ji su svi tu za kvalitetan odmor. Hrana obilna i ukusna. Kafi캖 je odli캜an i pristupa캜ne cijene. Vrati캖u se sigurno,,10,Hotel je stvarno jedan od boljih hotela na Zlatiboru. Osoblje profesionalno. Soba uredna i 캜ista. Sadr쬬ji su svi tu za kvalitetan odmor. Hrana obilna i ukusna. Kafi캖 je odli캜an i pristupa캜ne cijene. Vrati캖u se sigurno 
"캛isto캖a, hrana, usluga, sve je bilo super",Nemam ni jednu zamerku,10,"캛isto캖a, hrana, usluga, sve je bilo super Nemam ni jednu zamerku"
"Apartman je jako lep i 캜ist, lokacija je odli캜na, osoblje veoma ljubazno i predusretljivo.","Premali spa centar, termini se ne rezervi코u, tako da je gu쭀a ogromna.",8,"Apartman je jako lep i 캜ist, lokacija je odli캜na, osoblje veoma ljubazno i predusretljivo. Premali spa centar, termini se ne rezervi코u, tako da je gu쭀a ogromna."
Sve,Sve je superrr,10,Sve Sve je superrr
"Sve je bilo izuzetno. Iznad svih na코ih o캜ekivanja.
Ve캖 razmi코ljamo o ponovnom boravku u va코em objektu",Nemamo zamerke,10,"Sve je bilo izuzetno. Iznad svih na코ih o캜ekivanja.
Ve캖 razmi코ljamo o ponovnom boravku u va코em objektu Nemamo zamerke"
"Smestaj jako dobro opremljen. Hrana je odli캜na,raznovrsna. Ima raznih sadr쬬ja.Hotel se nalazi na super mestu, mirno okru쬰nje, a opet blizu svega. Usluga i ljubaznost zaposlenih je zaista za pohvalu.",Mo쬯a neka igraonica za malu decu游땕,10,"Smestaj jako dobro opremljen. Hrana je odli캜na,raznovrsna. Ima raznih sadr쬬ja.Hotel se nalazi na super mestu, mirno okru쬰nje, a opet blizu svega. Usluga i ljubaznost zaposlenih je zaista za pohvalu. Mo쬯a neka igraonica za malu decu游땕"
"Lokacija odlicna, sve je blizu, a na mirnom mjestu. Dorucak veoma dobar, raznovrstan,usluga takodje odlicna. Pogotovo recepcionerke! Sve u svemu odlican boravak, cistoca, usluga.. Sve preporuke!",Sve je u redu.,10,"Lokacija odlicna, sve je blizu, a na mirnom mjestu. Dorucak veoma dobar, raznovrstan,usluga takodje odlicna. Pogotovo recepcionerke! Sve u svemu odlican boravak, cistoca, usluga.. Sve preporuke! Sve je u redu."
"Hotel i smestaj lep,cist,uredan,na lepoj lokaciji u odnosu na centar i ljubaznim osobljem. Dorucak ukusan i raznovrstan u skladu sa tim sta se obicno jede za doeucak. Restoran prelep.",Djakuzi nije u funkciji a znacio bi pogotovo za malu decu gde mogu da se ugreju nakon bazena koji moze da bude malo topliji.,9,"Hotel i smestaj lep,cist,uredan,na lepoj lokaciji u odnosu na centar i ljubaznim osobljem. Dorucak ukusan i raznovrstan u skladu sa tim sta se obicno jede za doeucak. Restoran prelep. Djakuzi nije u funkciji a znacio bi pogotovo za malu decu gde mogu da se ugreju nakon bazena koji moze da bude malo topliji."
"Lokacija, soba i hrana",Spa,8,"Lokacija, soba i hrana Spa"
Doru캜ak je bio izvanredan kao i lokacija,"Sve mi se dopalo, i sve je prema코ilo moja o캜ekivanja",10,"Doru캜ak je bio izvanredan kao i lokacija Sve mi se dopalo, i sve je prema코ilo moja o캜ekivanja"
Enterijer je prelep i osoblje je veoma ljubazno.,Jedina mana ovog smestaja je bio neprijatan miris koji dolazi iz kupatilskih cevi.,9,Enterijer je prelep i osoblje je veoma ljubazno. Jedina mana ovog smestaja je bio neprijatan miris koji dolazi iz kupatilskih cevi.
"Sve je bilo sjajno, svaka preporuka",Mali spa,8,"Sve je bilo sjajno, svaka preporuka Mali spa"
"Odlican dorucak,za svakoga Po nesto.Lokacija super.",Ponasanje gostiji pojedinih u spa .,10,"Odlican dorucak,za svakoga Po nesto.Lokacija super. Ponasanje gostiji pojedinih u spa ."
"Lokacija, objekat, usluga.","Za spavanje u dnevnom boravku potreban nadusek ili nesto sli캜no, trosed neprijatno neudoban.",8,"Lokacija, objekat, usluga. Za spavanje u dnevnom boravku potreban nadusek ili nesto sli캜no, trosed neprijatno neudoban."
"Doru캜ak je na bazi 코vedskog stola i raznovrstan je. Sobe udobne, moderne i opremljene kuhinjom i terasom. Dobar internet, lokacija, spa-poseduje vreme za adults only.","Spora usluga u restoranu, restoransko osoblje bi moglo da bude malko ljubaznije. Gu쭀a u spa centru i manjak pe코kira/bademantila. Postoji period za kori코캖enje spa centra koji je predvi캠en za starije od 15 god, samo je potrebno da osoblje podseti goste na to.",8,"Doru캜ak je na bazi 코vedskog stola i raznovrstan je. Sobe udobne, moderne i opremljene kuhinjom i terasom. Dobar internet, lokacija, spa-poseduje vreme za adults only. Spora usluga u restoranu, restoransko osoblje bi moglo da bude malko ljubaznije. Gu쭀a u spa centru i manjak pe코kira/bademantila. Postoji period za kori코캖enje spa centra koji je predvi캠en za starije od 15 god, samo je potrebno da osoblje podseti goste na to."
Bazen sa slanom vodom. Parna i slana sauna. O li캜an doru캜ak. Osoblje veoma ljubazno.,,10,Bazen sa slanom vodom. Parna i slana sauna. O li캜an doru캜ak. Osoblje veoma ljubazno. 
"Nov objekat,prelepog eksterijera, na par minuta hoda od centra i od svih ostalih sadrzaja na Zlatiboru.Ljubazno osoblje na recepciji,cist hotel,sa modernim komfornim apartmanima, bogat,sadrzajan dorucak koji se stalno dopunjuje,jednom recju osecali smo se udobno,dobrodoslo i kao kod kuce.","Hotel ima mali spa centar.Licno mi je bazen mali za moj ukus,ali i on vrsi posao za trenutke opustanja,pogotovo kada nema mnogo gostiju.U hotelu se menjaju peskiri svakoga dana,ali se i ne sredjuje soba....krevet,kupatilo,sto mi opet nije predstavljalo problem,ali je u opisu pisalo da se sobe ciste svakoga dana,tako da je moja cerka cistacicu nazvala ,,peskiracica,,.",10,"Nov objekat,prelepog eksterijera, na par minuta hoda od centra i od svih ostalih sadrzaja na Zlatiboru.Ljubazno osoblje na recepciji,cist hotel,sa modernim komfornim apartmanima, bogat,sadrzajan dorucak koji se stalno dopunjuje,jednom recju osecali smo se udobno,dobrodoslo i kao kod kuce. Hotel ima mali spa centar.Licno mi je bazen mali za moj ukus,ali i on vrsi posao za trenutke opustanja,pogotovo kada nema mnogo gostiju.U hotelu se menjaju peskiri svakoga dana,ali se i ne sredjuje soba....krevet,kupatilo,sto mi opet nije predstavljalo problem,ali je u opisu pisalo da se sobe ciste svakoga dana,tako da je moja cerka cistacicu nazvala ,,peskiracica,,."
Doru캜ak je bio extra...Vi코e od o캜ekivanog...Nemojte da menjate nista i do캖i 캖emo opet...游봃,Sve nam se dopalo!Samo nastavite tako...Osoblje je veoma ljubazno...Krevet i jastuci udobni...Sve je ok!,10,Doru캜ak je bio extra...Vi코e od o캜ekivanog...Nemojte da menjate nista i do캖i 캖emo opet...游봃 Sve nam se dopalo!Samo nastavite tako...Osoblje je veoma ljubazno...Krevet i jastuci udobni...Sve je ok!
Doru캜ak fantasti캜an !,,10,Doru캜ak fantasti캜an ! 
Lokacija odlicna dorucek prekrasen,,9,Lokacija odlicna dorucek prekrasen 
Spa centar,,10,Spa centar 
Jako ljubazno i prijatno osoblje. Dobra lokacija.,Sve je bilo odli캜no.,10,Jako ljubazno i prijatno osoblje. Dobra lokacija. Sve je bilo odli캜no.
"Odli캜an dizajn, opremljenost apartmana, dobra lokacija, dobar sadr쬬j. Sve je prili캜no novo i kvalitetno, vredi ulo쬰n novac.",U spa centru nije bilo bade mantila. Potrebno je bolje organizovati taj deo.,9,"Odli캜an dizajn, opremljenost apartmana, dobra lokacija, dobar sadr쬬j. Sve je prili캜no novo i kvalitetno, vredi ulo쬰n novac. U spa centru nije bilo bade mantila. Potrebno je bolje organizovati taj deo."
Sve za 10,,10,Sve za 10 
,Nemam primjedbu!,10, Nemam primjedbu!
"Sve je novo, lokacija dobra. Odlican dorucak, cijene u restoranu korektne.","Od 2 lifta samo jedan radi koji nikad da stigne. Vise sam isao stepenicama nego liftom. Voda u bazenu prohladna, djakuzi od 3 puta koliko sam bio uopste nije radio. 
Pretpostavljam da se jos uvijek uhodavaju obzirom da je objakat nov pa cu zanemariti ove detalje koje sam napisao i vratiti se opet da im dam drugu sansu.",9,"Sve je novo, lokacija dobra. Odlican dorucak, cijene u restoranu korektne. Od 2 lifta samo jedan radi koji nikad da stigne. Vise sam isao stepenicama nego liftom. Voda u bazenu prohladna, djakuzi od 3 puta koliko sam bio uopste nije radio. 
Pretpostavljam da se jos uvijek uhodavaju obzirom da je objakat nov pa cu zanemariti ove detalje koje sam napisao i vratiti se opet da im dam drugu sansu."
"Apartman je odli캜an, dobro opremljen, komforan.Doru캜ak je odli캜an. 캛i코캖enje je redovno.","Velika gu쭀a u SPA centru, predla쬰m zakazivanje termina da bi uop코te mogao da se koristi.Nedostaju pe코kiri i mantili..Zbog velikog broja gostiju odre캠ivanje termina za doru캜ak 코to svakako nije ne코to 코to 쬰lite kada ste na odmoru.",8,"Apartman je odli캜an, dobro opremljen, komforan.Doru캜ak je odli캜an. 캛i코캖enje je redovno. Velika gu쭀a u SPA centru, predla쬰m zakazivanje termina da bi uop코te mogao da se koristi.Nedostaju pe코kiri i mantili..Zbog velikog broja gostiju odre캠ivanje termina za doru캜ak 코to svakako nije ne코to 코to 쬰lite kada ste na odmoru."
"Hotel je praznik za sva 캜ula: za o캜i (od izgleda posu캠a u sobama, preko rasvete do dizajna celokupnog enterijera), ukusa (izvrstan doru캜ak i hrana u restoranu), mirisa (savr코eno 캜isto sa vrlo prijatnim osve쬴va캜em vazduha u celom hotelu, pa i izbor sapuna, gela za tu코iranje i 코ampona) i uvek dobra muzika u restoranu. Funkcionalnost na najvi코em nivou (npr. puno prostora za odlaganje stvari u kupatilu; pravo iz gara쬰 liftom do sobe). Odli캜no grejanje (podno u kupatilu).","Na sajtu bi trebalo da bude istaknuto da deca mogu da koriste bazen samo do 18h. Moje iskustvo je da je oko 17h velika gu쭀a, dok je oko 20h bilo gotovo prazno.",10,"Hotel je praznik za sva 캜ula: za o캜i (od izgleda posu캠a u sobama, preko rasvete do dizajna celokupnog enterijera), ukusa (izvrstan doru캜ak i hrana u restoranu), mirisa (savr코eno 캜isto sa vrlo prijatnim osve쬴va캜em vazduha u celom hotelu, pa i izbor sapuna, gela za tu코iranje i 코ampona) i uvek dobra muzika u restoranu. Funkcionalnost na najvi코em nivou (npr. puno prostora za odlaganje stvari u kupatilu; pravo iz gara쬰 liftom do sobe). Odli캜no grejanje (podno u kupatilu). Na sajtu bi trebalo da bude istaknuto da deca mogu da koriste bazen samo do 18h. Moje iskustvo je da je oko 17h velika gu쭀a, dok je oko 20h bilo gotovo prazno."
Odli캜na lokacija i prostrani apartmani.,"Mali bazen sa prohladnom vodom, nedovoljno prostora za toliki broj gostiju.",10,"Odli캜na lokacija i prostrani apartmani. Mali bazen sa prohladnom vodom, nedovoljno prostora za toliki broj gostiju."
"Doru캜ak, lokacija, soba, ambijent, osoblje.",,9,"Doru캜ak, lokacija, soba, ambijent, osoblje. "
"Odli캜an hotel,sjajan enterijer! Udoban,캜ist. Svideo nam se spa,dorucak je raznolik i ukusan. Gara쬬 dosta znaci u zimskom periodu. Sve preporuke!",,10,"Odli캜an hotel,sjajan enterijer! Udoban,캜ist. Svideo nam se spa,dorucak je raznolik i ukusan. Gara쬬 dosta znaci u zimskom periodu. Sve preporuke! "
"Odli캜an doru캜ak, apartman 캜ist i uredan, osoblje ljubazno.",,10,"Odli캜an doru캜ak, apartman 캜ist i uredan, osoblje ljubazno. "
"To 코to je 캜isto, uredno i novo.",,10,"To 코to je 캜isto, uredno i novo. "
"Sve nam se dopalo. Lokacija je odlicna, osoblje je jako ljubazno, dorucak korektan. Sobe su moderno opremljene, sve funkcioni코e.
Definitivno za preporuku 游눪",Voda u bazenu je hladnija.,10,"Sve nam se dopalo. Lokacija je odlicna, osoblje je jako ljubazno, dorucak korektan. Sobe su moderno opremljene, sve funkcioni코e.
Definitivno za preporuku 游눪 Voda u bazenu je hladnija."
Usluga i privatnost,Nema jista da mi se jije dopalo sve je i vise nego korektno,10,Usluga i privatnost Nema jista da mi se jije dopalo sve je i vise nego korektno
,SPA centar bi mogao biti ve캖i.,10, SPA centar bi mogao biti ve캖i.
Sve pohvale za osoblje hotela!,,10,Sve pohvale za osoblje hotela! 
Sve je bilo savrseno,Hladna voda u bazenu u spa centru,10,Sve je bilo savrseno Hladna voda u bazenu u spa centru
"Odli캜an sme코taj, jako prijatan restoran.",,9,"Odli캜an sme코taj, jako prijatan restoran. "
"Odlican hotel na odlicnoj lokaciji. 
Veliki parking, SPA centar I odlican restoran. 
Za svaku preporuku!",,10,"Odlican hotel na odlicnoj lokaciji. 
Veliki parking, SPA centar I odlican restoran. 
Za svaku preporuku! "
