positive,negative,rating,comments
"Osoblje,higijena,smestaj sve na visokom nivou.
Tako da sledeci boravak u Bg.samo kod vas",,10,"Osoblje,higijena,smestaj sve na visokom nivou.
Tako da sledeci boravak u Bg.samo kod vas "
"Odli캜an, prostran i udoban apartman, super lokacija, ima svoj parking. Sve preporuke.",,10,"Odli캜an, prostran i udoban apartman, super lokacija, ima svoj parking. Sve preporuke. "
"Odli캜na lokacija, vrhunski opremljeni apartmani!",,10,"Odli캜na lokacija, vrhunski opremljeni apartmani! "
"Odlicna lokacija, izuzetno uredno i cisto. Vrlo komforan porodicni apartman. Pohvale za ljubazno osoblje, posebno hvala gospodjici Isidori.
Sve preporuke.",Ulaz u garazu moze biti problematican za niza auta.,10,"Odlicna lokacija, izuzetno uredno i cisto. Vrlo komforan porodicni apartman. Pohvale za ljubazno osoblje, posebno hvala gospodjici Isidori.
Sve preporuke. Ulaz u garazu moze biti problematican za niza auta."
"Odli캜na lokacija, 캜isto i udobno,pohvale",,10,"Odli캜na lokacija, 캜isto i udobno,pohvale "
Uvijek na visini zadatka.,"Gosti u apartmanu iznad mog su pravili haos do jutra, pa se nije moglo odmoriti. Ali to nije problem do objekta.",8,"Uvijek na visini zadatka. Gosti u apartmanu iznad mog su pravili haos do jutra, pa se nije moglo odmoriti. Ali to nije problem do objekta."
"Velicina prostora, udobnost","Centralno grejanje u nasem apartmanu nije radilo, iako su cevi do radijatora bile tople, radijatori su bili hladni pa smo se grejali na klimu. masina za sudove nije radila.",9,"Velicina prostora, udobnost Centralno grejanje u nasem apartmanu nije radilo, iako su cevi do radijatora bile tople, radijatori su bili hladni pa smo se grejali na klimu. masina za sudove nije radila."
"Usluga i smestaj za sve pohvale.
Devojke na recepciji su jako fine i profesionalne. Cistoca top. Sve nam je bilo blizu i definitivno cemo doci opet.",,10,"Usluga i smestaj za sve pohvale.
Devojke na recepciji su jako fine i profesionalne. Cistoca top. Sve nam je bilo blizu i definitivno cemo doci opet. "
Lokacija je odli캜na.,Nema lift,9,Lokacija je odli캜na. Nema lift
Apsolutno sve! Od osoblja do jedinice. 캛istoca na prvom mestu. Veliki prostor. Novo.,Nemam zamerki! Po prvi put...,10,Apsolutno sve! Od osoblja do jedinice. 캛istoca na prvom mestu. Veliki prostor. Novo. Nemam zamerki! Po prvi put...
"Preporuka za profesionalnost i uslugu!
Apartmani koji se nalaze u centru Beograda, 캜isto캖a i odli캜na cena.
Svakako da naglasim i sve pohvale za uslugu transfera .
Vidimo se opet uskoro!!",,10,"Preporuka za profesionalnost i uslugu!
Apartmani koji se nalaze u centru Beograda, 캜isto캖a i odli캜na cena.
Svakako da naglasim i sve pohvale za uslugu transfera .
Vidimo se opet uskoro!! "
"Sve pohvale za apartman. Higijena na zavidnom nivou. Lokacija savr코ena,bukvalno vam je sve na dohvat ruke. Sve pohvale za osoblje na recepciji koji su tu za vas 24 sata. Rado 캖u opet da se vratim. I preporuka za sve one koje 쬰le savr코en odmor i u쬴vanje.",,10,"Sve pohvale za apartman. Higijena na zavidnom nivou. Lokacija savr코ena,bukvalno vam je sve na dohvat ruke. Sve pohvale za osoblje na recepciji koji su tu za vas 24 sata. Rado 캖u opet da se vratim. I preporuka za sve one koje 쬰le savr코en odmor i u쬴vanje. "
Sve ..,,10,Sve .. 
"Sve je izvanredno, osoblje, smestaj, cistoca, udobnost i prostranost. Uvek cu se rado vratiti.",,10,"Sve je izvanredno, osoblje, smestaj, cistoca, udobnost i prostranost. Uvek cu se rado vratiti. "
"Izuzetno cisto, apartman opremljen sa svim sto je potrebno, lokacija izvanredna",Problem s tusem na kojem je teko regulisati toplotu vode,10,"Izuzetno cisto, apartman opremljen sa svim sto je potrebno, lokacija izvanredna Problem s tusem na kojem je teko regulisati toplotu vode"
"Prostrana jedinica, ima sve sto je potrebno od sadrzaja.
Cisto i udobno",Cena moze biti malo povoljnija,9,"Prostrana jedinica, ima sve sto je potrebno od sadrzaja.
Cisto i udobno Cena moze biti malo povoljnija"
Lokacija,"Taman, poluuredno, u trosed smo nasli stravi od predhodnih vlasnika, posteljina iscepana.",7,"Lokacija Taman, poluuredno, u trosed smo nasli stravi od predhodnih vlasnika, posteljina iscepana."
"Lokacija, velicina apartmana, enterijer je ok, ali ne i u skladu sa cenom.","1. Cistoca - povedite racuna o cistoci kupatila
2. zaposlena je naplatila boravisnu taksu samo zato sto ne zna a ocita licnu kartu - misli da je ocitavanje isto sto i skeniranje, ne zna za pojam ""ocitati licnu kartu"" (adresa sa cipa je iz Beograda i taksa nije podlozna placanju samim tim, pa je imala komentar ""jel vam skupo da platite taksu"" - nije poenta u ceni vec poznavanju rada i ljubaznosti)
3. Naplata paodrkinga od 10e od uvece do ujutru je neprihvatljiva, narocito sto nije parking u garazi vec je auto bio izlozen na suncu
4. Cena vs kvalitet usluge nije relevantna",6,"Lokacija, velicina apartmana, enterijer je ok, ali ne i u skladu sa cenom. 1. Cistoca - povedite racuna o cistoci kupatila
2. zaposlena je naplatila boravisnu taksu samo zato sto ne zna a ocita licnu kartu - misli da je ocitavanje isto sto i skeniranje, ne zna za pojam ""ocitati licnu kartu"" (adresa sa cipa je iz Beograda i taksa nije podlozna placanju samim tim, pa je imala komentar ""jel vam skupo da platite taksu"" - nije poenta u ceni vec poznavanju rada i ljubaznosti)
3. Naplata paodrkinga od 10e od uvece do ujutru je neprihvatljiva, narocito sto nije parking u garazi vec je auto bio izlozen na suncu
4. Cena vs kvalitet usluge nije relevantna"
,"Razo캜aran, apartman u drugoj zgradi ne u toj gde sam rezervisao a niko me o tome nije obavestio. Bitno im je izgleda samo da uzmu novac. Tu코 kabina premalena,vrata na tu코 kabini spala tokom tu코iranja,vrata od fri쬴dera skoro pa otpala,svetlo kada klikne코 na prekida캜 da ga upali코 samo 코to ne eksplodira a svetlo svakako ne radi blinka samo kao da ste u diskoteci. Kada sam otvorio ladicu u kojoj stoje no쬰vi  vilju코ke i ka코ike da uzmem ka코iku morao sam prvo da je operem pa zatim da istu koristim,neverovatno. A prilikom odjavljivanja niko se nije udostojio da te pita kakav je bio boravak da li je sve bilo u redu, ipak ste dobili sobu u drugoj zgradi, jeste li zadovoljni. Ne preporu캜ujem nikom da boravi u ovom sme코taju.",1," Razo캜aran, apartman u drugoj zgradi ne u toj gde sam rezervisao a niko me o tome nije obavestio. Bitno im je izgleda samo da uzmu novac. Tu코 kabina premalena,vrata na tu코 kabini spala tokom tu코iranja,vrata od fri쬴dera skoro pa otpala,svetlo kada klikne코 na prekida캜 da ga upali코 samo 코to ne eksplodira a svetlo svakako ne radi blinka samo kao da ste u diskoteci. Kada sam otvorio ladicu u kojoj stoje no쬰vi  vilju코ke i ka코ike da uzmem ka코iku morao sam prvo da je operem pa zatim da istu koristim,neverovatno. A prilikom odjavljivanja niko se nije udostojio da te pita kakav je bio boravak da li je sve bilo u redu, ipak ste dobili sobu u drugoj zgradi, jeste li zadovoljni. Ne preporu캜ujem nikom da boravi u ovom sme코taju."
Sve je bilo savrseno! Sigurno cemo doci ponovo 仇벒잺,,10,Sve je bilo savrseno! Sigurno cemo doci ponovo 仇벒잺 
Dorucak je bio ok.,Sve je bilo bozanstveno . 仇벒잺,10,Dorucak je bio ok. Sve je bilo bozanstveno . 仇벒잺
,Slaba klimatizacija sobe,8, Slaba klimatizacija sobe
Dorucak je bio izuzetan,,9,Dorucak je bio izuzetan 
"Provela sam u Woodlandu noc pre i noc posle svadbe. Osoblje je izuzetno. Dozvolili su da dodje fotograf da nas slika, imali smo ceo Resort na raspolaganju.",,10,"Provela sam u Woodlandu noc pre i noc posle svadbe. Osoblje je izuzetno. Dozvolili su da dodje fotograf da nas slika, imali smo ceo Resort na raspolaganju. "
Sve je bilo izvrsno. Osoblje je preljubazno. Sigurno 캖emo se ponovo vratiti.,,10,Sve je bilo izvrsno. Osoblje je preljubazno. Sigurno 캖emo se ponovo vratiti. 
Osoblje je izuzetno ljubazno. Sadrzaj resorta je veoma dobar.,,9,Osoblje je izuzetno ljubazno. Sadrzaj resorta je veoma dobar. 
bazen je odlican apartman takodje osoblje vrlo korektno pozicija objekta odlicna sadrzaj dobar,,8,bazen je odlican apartman takodje osoblje vrlo korektno pozicija objekta odlicna sadrzaj dobar 
"Interesantna lokacija, rusti캜nim stil, dovoljno prostora","Pau캜ina, pra코ina, neudoban du코ek. Tokom no캖i nije bilo vode.",5,"Interesantna lokacija, rusti캜nim stil, dovoljno prostora Pau캜ina, pra코ina, neudoban du코ek. Tokom no캖i nije bilo vode."
"Dorucak je odlican, bogat, lepo spremljen uvek, osoblje je jako ljubazno i zeli da izadje u susret. Sobe su kada se dodje uredne, posteljina koju gosti dobiju je cista, ima peskira, bade mantila, peskira za bazen. Bazen izgleda divno, danju a i nocu sa osvetljenjem. Hrana je generalno odlicna.","Bazen je bio prehladan, svakoga dana, neocekivano za letnji period sa jakim vrucinama. Vodokotlic radi na gurku, nije da ne radi ali mora da se pogura sa premestanjem i pozicioniranjem. Vikendom su zurke i to je lepo napisano i najavljeno ali izgleda da su i radnim danima, jedno vece je bilo do 1 i ne toliko glasno, dok je na primer u sredu bilo jako glasno sa ekipom mladih ljudi koji su pustali muziku i drali se do 04. Nije zahvalno za radni odmor. Niko nije menjao posteljinu, peskire, sredjivao sobu, iznosio djubre, to izgleda da je izostavljeno skroz iz usluge.",7,"Dorucak je odlican, bogat, lepo spremljen uvek, osoblje je jako ljubazno i zeli da izadje u susret. Sobe su kada se dodje uredne, posteljina koju gosti dobiju je cista, ima peskira, bade mantila, peskira za bazen. Bazen izgleda divno, danju a i nocu sa osvetljenjem. Hrana je generalno odlicna. Bazen je bio prehladan, svakoga dana, neocekivano za letnji period sa jakim vrucinama. Vodokotlic radi na gurku, nije da ne radi ali mora da se pogura sa premestanjem i pozicioniranjem. Vikendom su zurke i to je lepo napisano i najavljeno ali izgleda da su i radnim danima, jedno vece je bilo do 1 i ne toliko glasno, dok je na primer u sredu bilo jako glasno sa ekipom mladih ljudi koji su pustali muziku i drali se do 04. Nije zahvalno za radni odmor. Niko nije menjao posteljinu, peskire, sredjivao sobu, iznosio djubre, to izgleda da je izostavljeno skroz iz usluge."
"Predivni doma캖ini, predivni objekti, 캜isto, udobno, sre캠eno, fenomenalno za decu. O pogledu i prirodi da ne pri캜amo...",,10,"Predivni doma캖ini, predivni objekti, 캜isto, udobno, sre캠eno, fenomenalno za decu. O pogledu i prirodi da ne pri캜amo... "
"Sve nam se dopalo, ljubazni doma캖ini, ukusan doru캜ak, sadr쬬ji za decu, lokacija...ocena od nas je 10+ 
Preporuka svima, vrati캖emo se kad-tad ponovo 游뗵游녨",,10,"Sve nam se dopalo, ljubazni doma캖ini, ukusan doru캜ak, sadr쬬ji za decu, lokacija...ocena od nas je 10+ 
Preporuka svima, vrati캖emo se kad-tad ponovo 游뗵游녨 "
Sve je fenomenalno! Gostoprimstvo domacina je za svaku pohvalu. Mozete da porucite dorucak ako zelite i domacini prave pravi domacinski dorucak.,Nema zamerki.,10,Sve je fenomenalno! Gostoprimstvo domacina je za svaku pohvalu. Mozete da porucite dorucak ako zelite i domacini prave pravi domacinski dorucak. Nema zamerki.
"Izuzetno ljubazni doma캖ini, odlu캜na lokacija, divan pogled.",,10,"Izuzetno ljubazni doma캖ini, odlu캜na lokacija, divan pogled. "
"Jako ljubazni i srda캜ni doma캖ini, gostoprimstvo na najvi코em nivou. Odli캜no mesto za odmor i u쬴vanje u prirodi. Sve pohvale i preporuke!",,10,"Jako ljubazni i srda캜ni doma캖ini, gostoprimstvo na najvi코em nivou. Odli캜no mesto za odmor i u쬴vanje u prirodi. Sve pohvale i preporuke! "
"[ENG] The host was extremely helpful, professional and friendly. The flat was tidy with all mod cons (incl. dishwasher, microwave, washing machine, balcony and many more other utilities). Fast internet, and good choice of TV channels. Very close to the city best spots, including trendy cafes, restouranunts, street food grills and shopping malls. Paticularly good for dental treatment and tourism arrangement - please contact the host for more details.

[SRB] Doma캖in je bio vrlo ljubazan, profesionalan i od pomo캖i. Stan je bio vrlo uredan i potpuno opremljen (ma코ina za sudove, mikrotalasna, ve코 ma코ina, terasa i drugo). Bryi internet i dobar izbor TV kanala. Vrlo blizu centru i najboljim mestima za izlazak u gradu kao trendi kafi캖i, restorani, kiosci sa ro코tiljom i 코oping centri.  Doma캖in 캖e vam tako캠e objasniti sve u vezi kvalitetnog dentalnog tretmana i turizma.","[ENG] There are some building works nearby, generally this is the case across the city, but at no time it caused any problems. The sound isolation (double-glazed windows and doors) was fully satisfactory.

[SRB] Trenutno se grade nove zgrade u relativnoj blizini, kao uostalom i ve캖em delu grada, ali ni u kom momentu to nije predstavljalo problem.  Zvu캜na izolacija (PVC pozori i vrata) je bila zadovoljavalju캖a.",10,"[ENG] The host was extremely helpful, professional and friendly. The flat was tidy with all mod cons (incl. dishwasher, microwave, washing machine, balcony and many more other utilities). Fast internet, and good choice of TV channels. Very close to the city best spots, including trendy cafes, restouranunts, street food grills and shopping malls. Paticularly good for dental treatment and tourism arrangement - please contact the host for more details.

[SRB] Doma캖in je bio vrlo ljubazan, profesionalan i od pomo캖i. Stan je bio vrlo uredan i potpuno opremljen (ma코ina za sudove, mikrotalasna, ve코 ma코ina, terasa i drugo). Bryi internet i dobar izbor TV kanala. Vrlo blizu centru i najboljim mestima za izlazak u gradu kao trendi kafi캖i, restorani, kiosci sa ro코tiljom i 코oping centri.  Doma캖in 캖e vam tako캠e objasniti sve u vezi kvalitetnog dentalnog tretmana i turizma. [ENG] There are some building works nearby, generally this is the case across the city, but at no time it caused any problems. The sound isolation (double-glazed windows and doors) was fully satisfactory.

[SRB] Trenutno se grade nove zgrade u relativnoj blizini, kao uostalom i ve캖em delu grada, ali ni u kom momentu to nije predstavljalo problem.  Zvu캜na izolacija (PVC pozori i vrata) je bila zadovoljavalju캖a."
Odlicna lokacija. Prostrani stan sa garazom. Ljubazni domacin sa kojim je saradnja lagana. Sve preporuke,,10,Odlicna lokacija. Prostrani stan sa garazom. Ljubazni domacin sa kojim je saradnja lagana. Sve preporuke 
Odli캜an prostor za vi코e ljudi,,10,Odli캜an prostor za vi코e ljudi 
Vrhunski sme코taj u centru grada. 캛ista desetka. Za svaku preporuku.,,10,Vrhunski sme코taj u centru grada. 캛ista desetka. Za svaku preporuku. 
"Prostranost, 캜isto캖a, udobnost, komunikacija",Sve je bilo super,10,"Prostranost, 캜isto캖a, udobnost, komunikacija Sve je bilo super"
"Dobro opremljen sme코taj, sve je bilo u redu.",Ni코ta sto bi uticalo na utisak da je sme코taj odli캜an.,9,"Dobro opremljen sme코taj, sve je bilo u redu. Ni코ta sto bi uticalo na utisak da je sme코taj odli캜an."
"Dobra lokacija, dobar smestaj, sve pohvale",,10,"Dobra lokacija, dobar smestaj, sve pohvale "
"Apartman je na odli캜noj lokaciji, 캜ist, uredan i lepo opremljen. Doma캖in je veoma prijatan 캜ovek lako smo se sve dogovorili. 캛im bude bilo prilike dolazimo ponovo. Preporuka! :)",,10,"Apartman je na odli캜noj lokaciji, 캜ist, uredan i lepo opremljen. Doma캖in je veoma prijatan 캜ovek lako smo se sve dogovorili. 캛im bude bilo prilike dolazimo ponovo. Preporuka! :) "
"Fantasticna lokacija. Odlicna mesta za izlazak blok levo, a divan park za decu dva bloka desno. Cisto, komforno, usluzan i strucan domacin. Mi dosli u tranzitu za more, pa ponovo u povratku.",,10,"Fantasticna lokacija. Odlicna mesta za izlazak blok levo, a divan park za decu dva bloka desno. Cisto, komforno, usluzan i strucan domacin. Mi dosli u tranzitu za more, pa ponovo u povratku. "
"Blizu centra grada, cisto, domacin je bio ljubazan",Nemam zamerke,10,"Blizu centra grada, cisto, domacin je bio ljubazan Nemam zamerke"
"Apartman je jako lepo sredjen, cist i prostran, sa svim sadr쬬jima koji su potrebni za boravak cak i duze, na odlicnom mestu u centru grada odakle se lako i brzo stizem pe코ice  do svih znamenitosti.
Ima obezbedjenu garazu koja se moze koristiti uz doplatu.",,10,"Apartman je jako lepo sredjen, cist i prostran, sa svim sadr쬬jima koji su potrebni za boravak cak i duze, na odlicnom mestu u centru grada odakle se lako i brzo stizem pe코ice  do svih znamenitosti.
Ima obezbedjenu garazu koja se moze koristiti uz doplatu. "
"Udoban i lepo opremljen sme코taj, privatan parking. Za svaku preporuku...",,10,"Udoban i lepo opremljen sme코taj, privatan parking. Za svaku preporuku... "
"Sjajan apartman, odlicna lokacija, garaza za parkiranje auta. Domacin jako ljubazan. Sve preporuke!",,10,"Sjajan apartman, odlicna lokacija, garaza za parkiranje auta. Domacin jako ljubazan. Sve preporuke! "
"I vi코e nego zadovoljni, doma캖in ljubazan, sa캜ekao u dogovoreno vreme, dostupan za dogovor. Lokacija je odli캜na, bilo da ste u Ni코u zbog odmora, ili posla. Apartman 캜ist, sa svim sadr쬬jima koji su potrebni. Lako ste sti쬰 do lokacije sa autoputa, a gara쬬 u sklopu objekta isklju캜uje probleme oko tra쬰nja slobodnog parkinga u blizini.",,10,"I vi코e nego zadovoljni, doma캖in ljubazan, sa캜ekao u dogovoreno vreme, dostupan za dogovor. Lokacija je odli캜na, bilo da ste u Ni코u zbog odmora, ili posla. Apartman 캜ist, sa svim sadr쬬jima koji su potrebni. Lako ste sti쬰 do lokacije sa autoputa, a gara쬬 u sklopu objekta isklju캜uje probleme oko tra쬰nja slobodnog parkinga u blizini. "
"Lokacija je fenomenalna. Prekoputa zgrade ima pivnica Berta gde se moze doruckovati (hrana super), iza zgrade je prodavnica, u blizini ima i diskont pica, trafika i taksi stanica. Topla preporuka!",,9,"Lokacija je fenomenalna. Prekoputa zgrade ima pivnica Berta gde se moze doruckovati (hrana super), iza zgrade je prodavnica, u blizini ima i diskont pica, trafika i taksi stanica. Topla preporuka! "
"Extra stancic,prostran,moderan,kuhinja ima sve,super lokacija,parking u garazi zgrade,domacin za svaki dogovor..",,10,"Extra stancic,prostran,moderan,kuhinja ima sve,super lokacija,parking u garazi zgrade,domacin za svaki dogovor.. "
"Centar grada,odli캜na usluga.
Ni코 predivan grad za upoznati.",,10,"Centar grada,odli캜na usluga.
Ni코 predivan grad za upoznati. "
Sve,,10,Sve 
Top,,10,Top 
Doma캖in opu코ten i prijatan. Spreman za svaki dogovor.,,10,Doma캖in opu코ten i prijatan. Spreman za svaki dogovor. 
"Odli캜na lokacija, ljubazan doma캖in.",,10,"Odli캜na lokacija, ljubazan doma캖in. "
"Petar je pravi domacin, docekao nas kod zgrade, uveo u garazu, zatim u apartman, sve sa osmehom na licu. Pokazao nam smestaj, objasnio sve sto treba da znamo, malo popricao sa nama, ponudio nas rakijom i zatim otisao dalje sa komentarom da sta god nam treba da ga slobodno zovemo. Savrsen balans prijatnosti i ne zabadanja nosa :)
Lep apartman, udobni kreveti, odlicna lokacija.
Preporuka i za kafic berta prekoputa sa odlicnom klopom, izborom piva i super atmosferom.","Tag za otvaranje vrata radi samo na zadnjem ulazu u zgradu, ako cemo da sitnicarimo :)",10,"Petar je pravi domacin, docekao nas kod zgrade, uveo u garazu, zatim u apartman, sve sa osmehom na licu. Pokazao nam smestaj, objasnio sve sto treba da znamo, malo popricao sa nama, ponudio nas rakijom i zatim otisao dalje sa komentarom da sta god nam treba da ga slobodno zovemo. Savrsen balans prijatnosti i ne zabadanja nosa :)
Lep apartman, udobni kreveti, odlicna lokacija.
Preporuka i za kafic berta prekoputa sa odlicnom klopom, izborom piva i super atmosferom. Tag za otvaranje vrata radi samo na zadnjem ulazu u zgradu, ako cemo da sitnicarimo :)"
"Lokacija, garaza, sadrzaji...sve je super.",,10,"Lokacija, garaza, sadrzaji...sve je super. "
"Prelep i prostran stan, vlasnik odlican i sklon svakom dogovoru, spreman da izadje u susret gostima maksimalno. Sve pohvale za apartman!",,10,"Prelep i prostran stan, vlasnik odlican i sklon svakom dogovoru, spreman da izadje u susret gostima maksimalno. Sve pohvale za apartman! "
Apartman za svaku pohvalu i preporuku!,,9,Apartman za svaku pohvalu i preporuku! 
"Lokacija u samom centru, 캜ist apartman, odli캜an za 5-6 osoba!
Svideo nam se i parking u gara쬴, kao i laka komunikacija sa doma캖inom. Preporuke!",,10,"Lokacija u samom centru, 캜ist apartman, odli캜an za 5-6 osoba!
Svideo nam se i parking u gara쬴, kao i laka komunikacija sa doma캖inom. Preporuke! "
"Stan pristojono sredjen,moderno i udobno.","Odrzavanje stana,higijena kuhinje i kupatila na veoma niskom nivou.Bila sam sa decom i jako mi je bitna cistoca,na zalost po tom pitanju razocarana...",8,"Stan pristojono sredjen,moderno i udobno. Odrzavanje stana,higijena kuhinje i kupatila na veoma niskom nivou.Bila sam sa decom i jako mi je bitna cistoca,na zalost po tom pitanju razocarana..."
"Lokacija je odli캜na, mirno mesto i jako blizu glavnog jezgra grada.",,10,"Lokacija je odli캜na, mirno mesto i jako blizu glavnog jezgra grada. "
"Fenomenalan smestaj, vlasnik ljubazan, izasao nam je u susret za sve, cak je i doneo dodatne igracke da nasem malcu bude kao kod kuce. Prezadoboljni smo i svima najtoplije preporucujemo.",,10,"Fenomenalan smestaj, vlasnik ljubazan, izasao nam je u susret za sve, cak je i doneo dodatne igracke da nasem malcu bude kao kod kuce. Prezadoboljni smo i svima najtoplije preporucujemo. "
Doma캖in koji se trudio da sve protekne u najboljem redu.Siguran sam da 캖u i slede캖i put odsesti na istom mestu,,10,Doma캖in koji se trudio da sve protekne u najboljem redu.Siguran sam da 캖u i slede캖i put odsesti na istom mestu 
"lokacija, udobnost",ostala je enigma kako se uklju캜uje radijator u kupatilu,8,"lokacija, udobnost ostala je enigma kako se uklju캜uje radijator u kupatilu"
"뤯얧햦혢햟햫 햟햟혝햪햟햫 향햟 혝혞햦혜혝햣 혞 햏햦혣혞. 햆쮏쐄 쮏햣햪혳햣햫, 햩쮏쥃썜햦혲햟 햠햩햦향혞 혡햣햫혝햟 햦햢햣햟햩햫햟 향햟 쮐혲햣혝혞 햡햩햟쒫쫧쟳 혜햟햢햤햟혲햦햪햟 햡햟햢햟 햏햦혣햟. 뉋햟혜햫햦햨 햟햟혝햪햟햫햟 쒫왏쮏쨿 혳혞햠햟향햟햫 햦 혞혜햩혞햤햟햫. 햣쮐혞햨햟 혜쒫쟳쨿.",,10,"뤯얧햦혢햟햫 햟햟혝햪햟햫 향햟 혝혞햦혜혝햣 혞 햏햦혣혞. 햆쮏쐄 쮏햣햪혳햣햫, 햩쮏쥃썜햦혲햟 햠햩햦향혞 혡햣햫혝햟 햦햢햣햟햩햫햟 향햟 쮐혲햣혝혞 햡햩햟쒫쫧쟳 혜햟햢햤햟혲햦햪햟 햡햟햢햟 햏햦혣햟. 뉋햟혜햫햦햨 햟햟혝햪햟햫햟 쒫왏쮏쨿 혳혞햠햟향햟햫 햦 혞혜햩혞햤햟햫. 햣쮐혞햨햟 혜쒫쟳쨿. "
"캛isto i uredno.
Blizu centra i tr쬹ih centara.

Vlasnik veoma ljubazan.",,10,"캛isto i uredno.
Blizu centra i tr쬹ih centara.

Vlasnik veoma ljubazan. "
"Lokacija, raspored u stanu, opremljenost.
Ljubazan doma캖in. Parking mesto u gara쬴.",Nije bio dobro o캜i코캖en stan od prethodnih gostiju.,7,"Lokacija, raspored u stanu, opremljenost.
Ljubazan doma캖in. Parking mesto u gara쬴. Nije bio dobro o캜i코캖en stan od prethodnih gostiju."
Ni코ta nam se nije dopalo vlasnik stana nam je ulazio u apartman brljao dok mi nismo bili tu. gasio klimu i grejanje. Zaklju캜ava sme코taj kada je on to hteo i sli캜no tome. Molim. Booking da sankcionise ovo.,Ni코ta nam se nije dopalo vlasnik stana nam je ulazio u apartman brljao dok mi nismo bili tu. gasio klimu i grejanje. Zaklju캜ava sme코taj kada je on to hteo i sli캜no tome. Molim. Booking da sankcionise ovo. Sve u svemu blagi u쬬s od vlasnika. Velika negativna ocena. Da pripazw ljudi koji odlaze kod istog 캜oveka,5,Ni코ta nam se nije dopalo vlasnik stana nam je ulazio u apartman brljao dok mi nismo bili tu. gasio klimu i grejanje. Zaklju캜ava sme코taj kada je on to hteo i sli캜no tome. Molim. Booking da sankcionise ovo. Ni코ta nam se nije dopalo vlasnik stana nam je ulazio u apartman brljao dok mi nismo bili tu. gasio klimu i grejanje. Zaklju캜ava sme코taj kada je on to hteo i sli캜no tome. Molim. Booking da sankcionise ovo. Sve u svemu blagi u쬬s od vlasnika. Velika negativna ocena. Da pripazw ljudi koji odlaze kod istog 캜oveka
Lokacija je dobra,"Cena na na sajtu i vlasnikova se razlikovala ,jos je i dodatno naplatio parking u objektu.",2,"Lokacija je dobra Cena na na sajtu i vlasnikova se razlikovala ,jos je i dodatno naplatio parking u objektu."
"Svaka preporuka za boravak, apartmani su neverovatno uredni i lepo uredjeni. Veoma lak dogovor :)",,10,"Svaka preporuka za boravak, apartmani su neverovatno uredni i lepo uredjeni. Veoma lak dogovor :) "
"Divan apartman, moderan, cist. Vlasnik izuzetno ljubazan i predusretljiv. Za svaku preporuku!",,10,"Divan apartman, moderan, cist. Vlasnik izuzetno ljubazan i predusretljiv. Za svaku preporuku! "
Prijatan i udoban apartman. Brz i jednostavan check-in.,Deo posudja je bio prljav kada smo dosli. :(,9,Prijatan i udoban apartman. Brz i jednostavan check-in. Deo posudja je bio prljav kada smo dosli. :(
Sve preporuke,,10,Sve preporuke 
"Zaista je 캜ista desetka , a po na코em mi코ljenju i vi코e od toga. Sve preporuke za apartman i doma캖ina . U쬴vali smo . Do skorog vi캠enja 游",,10,"Zaista je 캜ista desetka , a po na코em mi코ljenju i vi코e od toga. Sve preporuke za apartman i doma캖ina . U쬴vali smo . Do skorog vi캠enja 游 "
Sve u apartmanu je bilo savr코eno i vlasnik je predusretljiv i ljubazan! Najvi코e nam se svidela kada :),,10,Sve u apartmanu je bilo savr코eno i vlasnik je predusretljiv i ljubazan! Najvi코e nam se svidela kada :) 
"Veoma cisto, lokacija odlicna, smestaj veoma udoban.",,10,"Veoma cisto, lokacija odlicna, smestaj veoma udoban. "
Apsolutno sve je bilo odli캜no! Sme코taj za svaku preporuku! Posebna pohvala za self check in!,,10,Apsolutno sve je bilo odli캜no! Sme코taj za svaku preporuku! Posebna pohvala za self check in! 
