positive,negative,rating,comments
sve je perfektno od enterijera do osoblja sve pohvale za osoblje i za razumevanje za svaku situaciju,,10,sve je perfektno od enterijera do osoblja sve pohvale za osoblje i za razumevanje za svaku situaciju 
Nisam doru캜kovao u hostelu,Sve je okej,8,Nisam doru캜kovao u hostelu Sve je okej
"Izuzetno 캜isto!
Dobra lokacija
MIRRR I ti코ina, wifi, uredna kupaonica, kuhinja, fina atmosfera..
VELIKI PROSTOR ZA IDLAGANHE, za veliki kofer",Ne postoji,10,"Izuzetno 캜isto!
Dobra lokacija
MIRRR I ti코ina, wifi, uredna kupaonica, kuhinja, fina atmosfera..
VELIKI PROSTOR ZA IDLAGANHE, za veliki kofer Ne postoji"
"Sve mi se dopalo. U hostel sam kasno do코la, u vreme kad recepcija ne radi. Poslati su mi kodovi da u캠em u hostel i sobu.Krevet udoban. Kupatilo 캜isto, sa svim 코to je potrebno. Sutradan na recepciji devojka je bila vrlo ljubazna.Svima bi preporu캜ila ovaj hostel.",,10,"Sve mi se dopalo. U hostel sam kasno do코la, u vreme kad recepcija ne radi. Poslati su mi kodovi da u캠em u hostel i sobu.Krevet udoban. Kupatilo 캜isto, sa svim 코to je potrebno. Sutradan na recepciji devojka je bila vrlo ljubazna.Svima bi preporu캜ila ovaj hostel. "
"Osoblje ljubazno,sve cisto a lokacija 10.",,9,"Osoblje ljubazno,sve cisto a lokacija 10. "
"Odli캜na lokacija nekoliko minuta pe코ke do Skup코tine, knez Mihajlove, mno코tvo prodavnica u okolini, pristupacno osoblje, lak check-in, 캜isto i sre캠eno. S obzirom da je na bulevaru soba gleda na ulicu, mislili smo da 캖e nam smetati buka ali prozori i terasna vrata odli캜no dihtuju tako da se ni코ta nije 캜ulo kad se zatvore.",,9,"Odli캜na lokacija nekoliko minuta pe코ke do Skup코tine, knez Mihajlove, mno코tvo prodavnica u okolini, pristupacno osoblje, lak check-in, 캜isto i sre캠eno. S obzirom da je na bulevaru soba gleda na ulicu, mislili smo da 캖e nam smetati buka ali prozori i terasna vrata odli캜no dihtuju tako da se ni코ta nije 캜ulo kad se zatvore. "
"Odli캜na lokacija, ljubazno osoblje, ok za kraci boravak.",Krevet i jastuci nisu bas udobni.,8,"Odli캜na lokacija, ljubazno osoblje, ok za kraci boravak. Krevet i jastuci nisu bas udobni."
"Lokacija, sve je savr코eno cisto, cista 10",,10,"Lokacija, sve je savr코eno cisto, cista 10 "
Savrsena lokacija i odlicna higijena unutar smestaja!,/,10,Savrsena lokacija i odlicna higijena unutar smestaja! /
"Objekat je odli캜an. Osoblje (devojke) ljubazne i profesionalne. 
Hostel je na odli캜noj lokaciji. Sobe i sve prostorije su 캜iste, nove i lepo sre캠ene. Ovaj hostel ima moju preporuku. 鮫봺잺",,10,"Objekat je odli캜an. Osoblje (devojke) ljubazne i profesionalne. 
Hostel je na odli캜noj lokaciji. Sobe i sve prostorije su 캜iste, nove i lepo sre캠ene. Ovaj hostel ima moju preporuku. 鮫봺잺 "
Osoblje,/,10,Osoblje /
"Hostel je koncepiran bez ludovanja,  쬿rki, galame i reke alkohola u pola no캖i. Osmi코ljen je za odmor, rad na ra캜unaru u bilo kojoj prostoriji i  opremljen je prvoklasno uredjenom kuhinjom 
Blizina stanice, ujedno za.1-3 km sve va쬹o vam je blizu pe코aka
Spavaonje imaju svaka svoje kupatilo, 코to je posebna pogodnost a krevet je sli캜an 'cacoon' sa svetlom, uti캜nicom mestom za sitnice.. ne코to 코to sam do쬴vljavala u Skandinaviji
Odli캜an!",Nema,10,"Hostel je koncepiran bez ludovanja,  쬿rki, galame i reke alkohola u pola no캖i. Osmi코ljen je za odmor, rad na ra캜unaru u bilo kojoj prostoriji i  opremljen je prvoklasno uredjenom kuhinjom 
Blizina stanice, ujedno za.1-3 km sve va쬹o vam je blizu pe코aka
Spavaonje imaju svaka svoje kupatilo, 코to je posebna pogodnost a krevet je sli캜an 'cacoon' sa svetlom, uti캜nicom mestom za sitnice.. ne코to 코to sam do쬴vljavala u Skandinaviji
Odli캜an! Nema"
"Rezervisao sam sme코taj u osmokrevetnoj sobi a bio sam sme코ten u boljoj jedinici bez dodatne doplate. No캖io sam u 코estokrevetnoj sobi. Kreveti maksimalno udobni, lampa pored kreveta kao i uti캜nica, dovoljno prostora za prtljag i internet signal odli캜an.",Nije bilo ni코ta za 코ta mogu da ka쬰m da mi se nije dopalo.,10,"Rezervisao sam sme코taj u osmokrevetnoj sobi a bio sam sme코ten u boljoj jedinici bez dodatne doplate. No캖io sam u 코estokrevetnoj sobi. Kreveti maksimalno udobni, lampa pored kreveta kao i uti캜nica, dovoljno prostora za prtljag i internet signal odli캜an. Nije bilo ni코ta za 코ta mogu da ka쬰m da mi se nije dopalo."
"Higijena na visokom nivou, sve pohvale.游눮游눪",,10,"Higijena na visokom nivou, sve pohvale.游눮游눪 "
"Odu코evila me komunikacija i predusretljivost doma캖ina, i koliko je soba bila 캜ista i prostrana. Rado 캖u do캖i ponovo. 驕쥞잺",,10,"Odu코evila me komunikacija i predusretljivost doma캖ina, i koliko je soba bila 캜ista i prostrana. Rado 캖u do캖i ponovo. 驕쥞잺 "
Osoblje je sjajno. Aleksandra najvi코e. Ljubazna i uvek na usluzi.,Sjajan hostel! Uvek 캖u se vra캖ati kad god sam u Beogradu.,10,Osoblje je sjajno. Aleksandra najvi코e. Ljubazna i uvek na usluzi. Sjajan hostel! Uvek 캖u se vra캖ati kad god sam u Beogradu.
캛isto캖a i ljubaznost osoblja,Fenomenalno mesto 游땕,10,캛isto캖a i ljubaznost osoblja Fenomenalno mesto 游땕
"Lokacija, veli캜ina dnevnog boravka",Krevet nename코ten,8,"Lokacija, veli캜ina dnevnog boravka Krevet nename코ten"
"Uredne sobe i prijatan ambijent. 
Blizina centra i odli캜na povezanost javnim prevozom.","Internet je veoma spor, na du쬰 vreme i potpuno neupotrebljiv i to verovatno zbog ""gostiju"" koji o캜igledno ""rade"" od ""ku캖e"" na ra캜unarima.",8,"Uredne sobe i prijatan ambijent. 
Blizina centra i odli캜na povezanost javnim prevozom. Internet je veoma spor, na du쬰 vreme i potpuno neupotrebljiv i to verovatno zbog ""gostiju"" koji o캜igledno ""rade"" od ""ku캖e"" na ra캜unarima."
"Ljubaznost, komunikacija, higijena, lokacija...",,9,"Ljubaznost, komunikacija, higijena, lokacija... "
,Odli캜no unutra코nje ozvu캜enje.,7, Odli캜no unutra코nje ozvu캜enje.
Location is the best. Right in the downtown. Grocery shop is across the street. Parking spot is minutes away.  Hosting team is friendly and efficient. Highly recommended.,"The apartment needs a bit of care. One of two showers was not work properly (clogs, loose shower fixture).",9,"Location is the best. Right in the downtown. Grocery shop is across the street. Parking spot is minutes away.  Hosting team is friendly and efficient. Highly recommended. The apartment needs a bit of care. One of two showers was not work properly (clogs, loose shower fixture)."
"Great big apartmrent in centar , you go by walk aniwehere in center for few mins . Apartment id very clean , has super wi-fi , the host is grate and very helpful 游땕 My big recomandation 游땕",,10,"Great big apartmrent in centar , you go by walk aniwehere in center for few mins . Apartment id very clean , has super wi-fi , the host is grate and very helpful 游땕 My big recomandation 游땕 "
"Great location in the city centre. Good choise for groups.
Communication with the owner was excellent and airport transfers were perfectly organized.",Some inventory could be renewed.,9,"Great location in the city centre. Good choise for groups.
Communication with the owner was excellent and airport transfers were perfectly organized. Some inventory could be renewed."
"Location, apartment, all was good","Why lie about the second bathroom that it broke down te morning before we entered the apartment when we can see clearly in the comments that the shower already was broken down some time before. It doesn't matter that it is broken down, that happens, it matters that you lie about it, don't do that, we are not stupid, we let you think we are stupid but we aren't. We just let you get away with a lie so that it wouldn't be uncomfortable for you to continue our conversation....:(",8,"Location, apartment, all was good Why lie about the second bathroom that it broke down te morning before we entered the apartment when we can see clearly in the comments that the shower already was broken down some time before. It doesn't matter that it is broken down, that happens, it matters that you lie about it, don't do that, we are not stupid, we let you think we are stupid but we aren't. We just let you get away with a lie so that it wouldn't be uncomfortable for you to continue our conversation....:("
"the location is amazing.a 5 minute walk to both Knez Mijaila and Skadarlija!!!  absolutely perfect.  and large enough for our family of 6.  The hostess, Alexandra, met us upon checkin뵪reat service.",Could use new flooring but we weren뗪 there to debate flooring.,9,"the location is amazing.a 5 minute walk to both Knez Mijaila and Skadarlija!!!  absolutely perfect.  and large enough for our family of 6.  The hostess, Alexandra, met us upon checkin뵪reat service. Could use new flooring but we weren뗪 there to debate flooring."
"The communication, the flexibility of the hostess and the apartment were a hit!
The apartment is very clean, spacious and absolutely corresponds to the photos!

Thank you for any accommodation and for the great reception!",,10,"The communication, the flexibility of the hostess and the apartment were a hit!
The apartment is very clean, spacious and absolutely corresponds to the photos!

Thank you for any accommodation and for the great reception! "
"Perfect location, central, cozy apartment, great host and big rooms. highly reccomended",,10,"Perfect location, central, cozy apartment, great host and big rooms. highly reccomended "
location,from the front front entrance to the apartment its difficult to carry luggage뗩 especially when you have big luggage and the lift is between stairs so either you need to climb down one floor for life and climb up one floor for the lift.,10,location from the front front entrance to the apartment its difficult to carry luggage뗩 especially when you have big luggage and the lift is between stairs so either you need to climb down one floor for life and climb up one floor for the lift.
"Timely communication, great care and attention to every details, complete peace of mind make this property a 100% satisfactory stay, particularly for family with children, and property is large enough to accommodate a large family. The top choice for our next visit.",,10,"Timely communication, great care and attention to every details, complete peace of mind make this property a 100% satisfactory stay, particularly for family with children, and property is large enough to accommodate a large family. The top choice for our next visit. "
"Large and spacious apartment. 3 full bedrooms 2 bathrooms was a bonus as well as the washing machine.
Location was really great, close to everything.",Shower grout and silicone could be replaced or cleaned better. Bed mattresses and pillows were not comfortable and should be replaced. Stains on the couch. Nothing major but small improvements would make this place amazing.,8,"Large and spacious apartment. 3 full bedrooms 2 bathrooms was a bonus as well as the washing machine.
Location was really great, close to everything. Shower grout and silicone could be replaced or cleaned better. Bed mattresses and pillows were not comfortable and should be replaced. Stains on the couch. Nothing major but small improvements would make this place amazing."
"Very convenient place if you need to stay in the Old Belgrade. Although it is located on a noisy street, the flat is quiet because the building it is in is in a courtyard.
Spacy living room, good Wi-Fi. Helpful owner.","Walls are dirty. In two of the rooms the bedside tables are broken, but the price is lower than the other flats around.
And I still haven't received the receipt for the payment.",8,"Very convenient place if you need to stay in the Old Belgrade. Although it is located on a noisy street, the flat is quiet because the building it is in is in a courtyard.
Spacy living room, good Wi-Fi. Helpful owner. Walls are dirty. In two of the rooms the bedside tables are broken, but the price is lower than the other flats around.
And I still haven't received the receipt for the payment."
Perfect,,10,Perfect 
"Really nice and big accommodation, very close to Republic Square....",,10,"Really nice and big accommodation, very close to Republic Square.... "
good location. Nice host.,,8,good location. Nice host. 
very big and in the city centre,"1 shower drain was plugged, so you practicly couldn뗪 shower. in the other shower the hot water was done after 10 minutes. if you are with a group of 6 people that isn뗪 enough",7,"very big and in the city centre 1 shower drain was plugged, so you practicly couldn뗪 shower. in the other shower the hot water was done after 10 minutes. if you are with a group of 6 people that isn뗪 enough"
Lokacija i izuzetna ljubaznost doma캖ina.,,10,Lokacija i izuzetna ljubaznost doma캖ina. 
"Doma캖in, apartman, lokacija",Manja kupaona jer curi voda iz tu코 kabine i bojlera.,9,"Doma캖in, apartman, lokacija Manja kupaona jer curi voda iz tu코 kabine i bojlera."
"snyggt, rent, ac, 2 toaletter helt perfekt",inget,10,"snyggt, rent, ac, 2 toaletter helt perfekt inget"
"locatie, ruimte, host (heeft ons ook nog naar de luchthaven gebracht.","2e badkamer moet wat klein onderhoud aan gepleegd worden, maar dat is dan ook alles.",9,"locatie, ruimte, host (heeft ons ook nog naar de luchthaven gebracht. 2e badkamer moet wat klein onderhoud aan gepleegd worden, maar dat is dan ook alles."
Stor bra l칛genhet o n칛rheten till centrala Belgrad.,,8,Stor bra l칛genhet o n칛rheten till centrala Belgrad. 
"햦쒫왐햩햦쒬햧 햢쮏쐄쮏얨혣햫혦햧 혠쮏혪햦햫,  햫햟혣햣햧 쮐혧햠햣 햨혞햦햩 햫쮏쒬혩 혜햨쮏쒫쮐쮏얨 햦 햠쮏혧혣혞혩 햨햟혜혝혩햩혩.
쮐혝쮐햫  햨쒫썜혝햦햣, 햢쒫 혜햟햫혞향햩햟. 
뤰햩햦혢햫쮏 햪햣혜혝쮏쮏쮏웷왏쫧쟳  혡햣햫혝햣."," 쮏얧쫧쮏 햦향 혜햟햩햣햫 햠혦햩 혠쮏쮏얧쫧. 
햌쮏쫧얧쟴햦쮏쫧왐혦 햟햠쮐햟햩햦 햫햟 쮏쐃쮏햣, 햫 햫쮐혧혩 햟햠쮐햟햩햦 쮐햣햫혧 햡쮏쨿쥃.
행햟 쮏쥃쫧쮏 햠혦햩햟 혜혝쮏좛쥃 햢햫혬햪, 햫햣햪햫쮏 혣혞햪햫.
햏햣햪햫쮏 햟혠햩  혜햟햫혞향햩햟혠, 햪쮏햩 햠혦 햠혦혝혧 혢햦혤햣.",8,"햦쒫왐햩햦쒬햧 햢쮏쐄쮏얨혣햫혦햧 혠쮏혪햦햫,  햫햟혣햣햧 쮐혧햠햣 햨혞햦햩 햫쮏쒬혩 혜햨쮏쒫쮐쮏얨 햦 햠쮏혧혣혞혩 햨햟혜혝혩햩혩.
쮐혝쮐햫  햨쒫썜혝햦햣, 햢쒫 혜햟햫혞향햩햟. 
뤰햩햦혢햫쮏 햪햣혜혝쮏쮏쮏웷왏쫧쟳  혡햣햫혝햣.  쮏얧쫧쮏 햦향 혜햟햩햣햫 햠혦햩 혠쮏쮏얧쫧. 
햌쮏쫧얧쟴햦쮏쫧왐혦 햟햠쮐햟햩햦 햫햟 쮏쐃쮏햣, 햫 햫쮐혧혩 햟햠쮐햟햩햦 쮐햣햫혧 햡쮏쨿쥃.
행햟 쮏쥃쫧쮏 햠혦햩햟 혜혝쮏좛쥃 햢햫혬햪, 햫햣햪햫쮏 혣혞햪햫.
햏햣햪햫쮏 햟혠햩  혜햟햫혞향햩햟혠, 햪쮏햩 햠혦 햠혦혝혧 혢햦혤햣."
"L'accueil, l뗜space, la localisation, la luminosit칠.",,9,"L'accueil, l뗜space, la localisation, la luminosit칠. "
L뗘ccueil chaleureux. Possible organisation de transfert arriv칠e d칠part. Flexibilit칠 des horaires arriv칠e d칠part. Un logement spacieux et lumineux. Des penderies.,,9,L뗘ccueil chaleureux. Possible organisation de transfert arriv칠e d칠part. Flexibilit칠 des horaires arriv칠e d칠part. Un logement spacieux et lumineux. Des penderies. 
Komforan apartman sa svim potrebnim za ugodan boravak.Lokacija savr코ena.,,10,Komforan apartman sa svim potrebnim za ugodan boravak.Lokacija savr코ena. 
疸괛쟑긻茗眄꼲丹벒쨃2疸쀤꼶覓付엂쨃쫸낊坍봰북꿋庸껁앵留庸껁읢流얶磅邏眄府넌꾼庸껀숵꾼疸擔皿쥘딦庸껄낻邏丹윈줤擔丹付뻔끾卵쐕땶磅辣庸껀쭏雷좫付얻쮡뒇鏤덛쭊雷썶쨃鏤덛쭊嵐쒼籃건술咐뙎뚟擔丹꿢螺,喇뻔잭疸쇈쯲庸껀럳쫁곷걂疸꽩뒃曇낁邏뒲쨃꿛燎樂쫸술醱疸낋궣旒좮燎쥒뛸봀疸꽧쨐굵旒좮欖眄걇邏쫹땶,10,疸괛쟑긻茗眄꼲丹벒쨃2疸쀤꼶覓付엂쨃쫸낊坍봰북꿋庸껁앵留庸껁읢流얶磅邏眄府넌꾼庸껀숵꾼疸擔皿쥘딦庸껄낻邏丹윈줤擔丹付뻔끾卵쐕땶磅辣庸껀쭏雷좫付얻쮡뒇鏤덛쭊雷썶쨃鏤덛쭊嵐쒼籃건술咐뙎뚟擔丹꿢螺 喇뻔잭疸쇈쯲庸껀럳쫁곷걂疸꽩뒃曇낁邏뒲쨃꿛燎樂쫸술醱疸낋궣旒좮燎쥒뛸봀疸꽧쨐굵旒좮欖眄걇邏쫹땶
"Unkomplizierte check in, gro른 der Wohnung.",Wir haben Tourismus Taxen bezahlt aber keine Quittungen oder Best칛tigung daf칲r bekommen.,8,"Unkomplizierte check in, gro른 der Wohnung. Wir haben Tourismus Taxen bezahlt aber keine Quittungen oder Best칛tigung daf칲r bekommen."
,햏햣햠쮏혧혣쮏 햪햦햫혞혜 쮏햩햟혝햟 혝쮏혧햨 햫햟햩햦혢햫혦햪햦.,10, 햏햣햠쮏혧혣쮏 햪햦햫혞혜 쮏햩햟혝햟 혝쮏혧햨 햫햟햩햦혢햫혦햪햦.
"Super Lage
Bequeme Betten
Unkomplizierte Host.","Schlechte Sauberkeit, Abfluss verstopft,  Wasser im WC l칛uft die ganze Zeit - nachts st칬rt.
Froteet칲cher alt, gr칛ulich sratt weiss.....
...",5,"Super Lage
Bequeme Betten
Unkomplizierte Host. Schlechte Sauberkeit, Abfluss verstopft,  Wasser im WC l칛uft die ganze Zeit - nachts st칬rt.
Froteet칲cher alt, gr칛ulich sratt weiss.....
..."
"Posizione perfetta. Nikola gentilissimo. La pulizia 칟 buona. Le camere sono spaziose, i letti buoni. Nel complesso una buona sistemazione per un gruppo.","Pulizia migliorabile. Non di nostro gradimento la moquette, in quanto poco presente in Italia. I bagni sono migliorabili con una maggiore manutenzione",7,"Posizione perfetta. Nikola gentilissimo. La pulizia 칟 buona. Le camere sono spaziose, i letti buoni. Nel complesso una buona sistemazione per un gruppo. Pulizia migliorabile. Non di nostro gradimento la moquette, in quanto poco presente in Italia. I bagni sono migliorabili con una maggiore manutenzione"
,"Husger친d, strykbr칛da och st칛dartiklar samt st칛dning",7," Husger친d, strykbr칛da och st칛dartiklar samt st칛dning"
"Postovani tim recepcije objekta Dream Rooms zaista smo uzivali.Lepota zivog grada Nisa u centru grada ,predivan objekat sa puno lepim manirima osoblja i vlasnice.Cisto,udobno i lepo. Jednom reciju mir u ukutkanom centru grada sa Apartmanima. Hvala Vam na.svemu.",Toga zaista nema!,10,"Postovani tim recepcije objekta Dream Rooms zaista smo uzivali.Lepota zivog grada Nisa u centru grada ,predivan objekat sa puno lepim manirima osoblja i vlasnice.Cisto,udobno i lepo. Jednom reciju mir u ukutkanom centru grada sa Apartmanima. Hvala Vam na.svemu. Toga zaista nema!"
Fantasti캜na lokacija domacice gostoprimljive 캜isto uredno  svaka preporuka za ovaj smestaj,Nemam zamerki,10,Fantasti캜na lokacija domacice gostoprimljive 캜isto uredno  svaka preporuka za ovaj smestaj Nemam zamerki
Sve je bio super!,Nema toga.,10,Sve je bio super! Nema toga.
"Sve je bilo super ,jako smo zadovoljni uslugom sme코taja.",Nema.,10,"Sve je bilo super ,jako smo zadovoljni uslugom sme코taja. Nema."
"Sve...osim sto su ljubazni ,veoma cisto,toplo,mirno..sve je bilo korektno, kafe mashina na recepciji sa odlicnom kafom.Preporucujem sve buducim gostima.",Toga zaista nema!,10,"Sve...osim sto su ljubazni ,veoma cisto,toplo,mirno..sve je bilo korektno, kafe mashina na recepciji sa odlicnom kafom.Preporucujem sve buducim gostima. Toga zaista nema!"
"Zadovoljni smestajem.Toplo,jako cisto i privatan parking.Proveli smo lepe dane u Nisu i ako je bio veliki minus napolju,mi smo bili prezadovoljni smestajem i sve nam je bilo blizu... Preporucujemo Dream Rooms!",Nema toga!,10,"Zadovoljni smestajem.Toplo,jako cisto i privatan parking.Proveli smo lepe dane u Nisu i ako je bio veliki minus napolju,mi smo bili prezadovoljni smestajem i sve nam je bilo blizu... Preporucujemo Dream Rooms! Nema toga!"
"Dopala nam se profesionalnost, ljubaznost osobalja sve je bilo kao u opisu i najboljem redu. Cisto,toplo i uredno sve najbolje.Vraticemo se ponovo!",Toga nema!,10,"Dopala nam se profesionalnost, ljubaznost osobalja sve je bilo kao u opisu i najboljem redu. Cisto,toplo i uredno sve najbolje.Vraticemo se ponovo! Toga nema!"
Stvarno je sve bilo 캜isto i uredno. Opis odgovara stanju u objektu.,,9,Stvarno je sve bilo 캜isto i uredno. Opis odgovara stanju u objektu. 
햍쮏쥃썜햦혲햟 혲햣 햦향쒫썛쫨햣햢햫햟. 햐햟햪 햟햟혝햪햟햫 혲햣 혢햦혜혝 햦 혞햢쮏쐃썛. 햆쮏쨿썜햦햫햦 혜혞 햦혲햟혝햫햦 햦 햣햢혞혜햣혝혳햦쒫.,,10,햍쮏쥃썜햦혲햟 혲햣 햦향쒫썛쫨햣햢햫햟. 햐햟햪 햟햟혝햪햟햫 혲햣 혢햦혜혝 햦 혞햢쮏쐃썛. 햆쮏쨿썜햦햫햦 혜혞 햦혲햟혝햫햦 햦 햣햢혞혜햣혝혳햦쒫. 
"캛isto, udobno. U centru grada je. Osoblje veoma ljubazno. Sve preporuke",,10,"캛isto, udobno. U centru grada je. Osoblje veoma ljubazno. Sve preporuke "
Odli캜ni!!!!,To ne postoji!,10,Odli캜ni!!!! To ne postoji!
Na코a porodica dolazi par godina unazad u ovaj sme코taj.Sve je bilo super kao i uvek.Osoblje recepcije profesionalno kao i vlasnica.Vratili smo se i za praznike. Preporu캜ujemo uvek od srca...,Nemamo zamerke.,10,Na코a porodica dolazi par godina unazad u ovaj sme코taj.Sve je bilo super kao i uvek.Osoblje recepcije profesionalno kao i vlasnica.Vratili smo se i za praznike. Preporu캜ujemo uvek od srca... Nemamo zamerke.
"Osoblje recepcije izuzetno ljubazno,apartmani su izvanredni,캜isti i topli.Profesionalnost vlasnice, izuzetno ljubazna.Imate sve 코to je potrebno za lep boravak.Primetio sam da pri캜aju vi코e stranih jezika na recepciji 코to je jako korisno. Preporu캜ujem 캜ista 10-ka.",,10,"Osoblje recepcije izuzetno ljubazno,apartmani su izvanredni,캜isti i topli.Profesionalnost vlasnice, izuzetno ljubazna.Imate sve 코to je potrebno za lep boravak.Primetio sam da pri캜aju vi코e stranih jezika na recepciji 코to je jako korisno. Preporu캜ujem 캜ista 10-ka. "
"Smestaj u samom centru, u veoma lepoj ulici.
Domacini veoma ljubazni.",,10,"Smestaj u samom centru, u veoma lepoj ulici.
Domacini veoma ljubazni. "
"Sve pohvale za apartman..Lokacija super,osoblje extra,smestaj jako dobar..Sve preporuke",,9,"Sve pohvale za apartman..Lokacija super,osoblje extra,smestaj jako dobar..Sve preporuke "
Sve uobi캜ajeno,"Stepenice  su vrlo strme
Jastuci  su neudobni",8,"Sve uobi캜ajeno Stepenice  su vrlo strme
Jastuci  su neudobni"
"Jako ljubazni domacini.
Sve je bilo kako treba.",,10,"Jako ljubazni domacini.
Sve je bilo kako treba. "
"Sve je bilo lepo 캜isto,toplo,osoblje super!",Nemam zamerke!,10,"Sve je bilo lepo 캜isto,toplo,osoblje super! Nemam zamerke!"
Preljubazna g.Dragana koja nas je docekala...auto nam.je bilo na sigurnom bez brige smo soavali..objekat je maximalno cist i udoban sve 10ke naspavao sam se suoer i bio svjez da nastavim putovanje dalje . ...,Nemam zamjerki niti jedne,10,Preljubazna g.Dragana koja nas je docekala...auto nam.je bilo na sigurnom bez brige smo soavali..objekat je maximalno cist i udoban sve 10ke naspavao sam se suoer i bio svjez da nastavim putovanje dalje . ... Nemam zamjerki niti jedne
Sve,X,10,Sve X
"Lokacija odlicna, na tri minuta od centralnog trga i keja. Osoblje veoma prijatno i usluzno. Parking obezbedjen!",Cudan raspored prostorija jer iz jedne sobe mora da se prodje u drugu sobu da bi se doslo do kupatila. Kad dodje vise ljudi to moze biti problem zbog privatnosti.,8,"Lokacija odlicna, na tri minuta od centralnog trga i keja. Osoblje veoma prijatno i usluzno. Parking obezbedjen! Cudan raspored prostorija jer iz jedne sobe mora da se prodje u drugu sobu da bi se doslo do kupatila. Kad dodje vise ljudi to moze biti problem zbog privatnosti."
,Sve je bilo odlivno. Za svaku preporuku.,10, Sve je bilo odlivno. Za svaku preporuku.
햖햦햨햟 햆햟햡햟햫 햦 혴햣햡쮏쒫 혵햣햨햟 햆햟햡햟햫햟 혜혞 쮐걤햣햫햦 혳혞햢햦. 햑혞햢햣 혜햣 햢햟 혜쒫 햠혞햢햣 햨햟햨 쒫썜똻 햦 햫햟 혴햦혠 혢쮏쒫왏 햪쮏웷 햢햟 혜햣 쮐햩쮏쫧. 햍쮏쥃썜햦혲햟 혲햣 쮏얧햦혢햫햟. 햏햦혲햣 햠햦햩 햫햦햨햟햨쒫쟴 쮏쐃햣햪햟.,,10,햖햦햨햟 햆햟햡햟햫 햦 혴햣햡쮏쒫 혵햣햨햟 햆햟햡햟햫햟 혜혞 쮐걤햣햫햦 혳혞햢햦. 햑혞햢햣 혜햣 햢햟 혜쒫 햠혞햢햣 햨햟햨 쒫썜똻 햦 햫햟 혴햦혠 혢쮏쒫왏 햪쮏웷 햢햟 혜햣 쮐햩쮏쫧. 햍쮏쥃썜햦혲햟 혲햣 쮏얧햦혢햫햟. 햏햦혲햣 햠햦햩 햫햦햨햟햨쒫쟴 쮏쐃햣햪햟. 
Sve pohvale vlasnicima na gostoprimstvu. Dragana i njen otac su veoma ljubazni i predusretljivi.,,10,Sve pohvale vlasnicima na gostoprimstvu. Dragana i njen otac su veoma ljubazni i predusretljivi. 
Lokacija je odli캜na.,,8,Lokacija je odli캜na. 
Lokacija je top,Sve je staro i kreveti smrde na znoj i ko zna sta vise. Nema klime. Trebali smo da budemo 2 noci ali posle prve smo nasli drugi smestaj i otisli.,1,Lokacija je top Sve je staro i kreveti smrde na znoj i ko zna sta vise. Nema klime. Trebali smo da budemo 2 noci ali posle prve smo nasli drugi smestaj i otisli.
Lokacija,"Stepeniste nije bezbedno,cak sta vise rizicno...jastuci isuvise tvrdi,visoki...dusek neudoban.Grejanje je na klimu,neprimereno zimskom periodu,kupatilo hladno bez grejanja.",2,"Lokacija Stepeniste nije bezbedno,cak sta vise rizicno...jastuci isuvise tvrdi,visoki...dusek neudoban.Grejanje je na klimu,neprimereno zimskom periodu,kupatilo hladno bez grejanja."
Ljubaznost osoblja.,"Postoje캖i klima ure캠aj nije bio u stanju da zagreje ceo stan, tako da smo se smrzli.",5,"Ljubaznost osoblja. Postoje캖i klima ure캠aj nije bio u stanju da zagreje ceo stan, tako da smo se smrzli."
